asin,title,brand,main_category,second_category,third_category,fourth_category,rank
B0006BHHGI,"36&quot; Beginners Adare Harp Package, Complete Celtic Package with Video Tutor",HarpsOnly,Musical Instruments,Band & Orchestra,Orchestral Strings,Harps,247524.0
B0006VVMUA,"Meinl Percussion MPE1BK High Pitch Percussion Block, Black",Meinl Percussion,Musical Instruments,Drums &amp; Percussion,Hand Percussion,Wood Blocks,154076.0
B0002GIVF8,John Pearse 300M 80/20 Bronze Acoustic Guitar Strings (Standard),John Pearse,Musical Instruments,Instrument Accessories,Guitar & Bass Accessories,Strings,39848.0
B0002F50PS,"Vater Super Jazz Wood Tip Hickory Drum Sticks, Pair",Vater,Musical Instruments,Instrument Accessories,Drum & Percussion Accessories,Drumsticks,24055.0
B0002KZQ84,Behringer Bass V-Amp The Ultimate Tone Toolbox For Bass/Acoustic/Electric Guitar And Keyboard Amp Modeling,Behringer,Musical Instruments,Amplifiers &amp; Effects,Guitar &amp; Bass Amplifiers,Bass Guitar Amplifiers,202127.0
B0002GXIX8,Zildjian K 18&quot; Dark Crash Thin Cymbal,Avedis Zildjian Company,Musical Instruments,Drums & Percussion,Drum Sets & Set Components,Cymbals,186981.0
B0002UP1ZW,MBT Classical Guitar Case - Lightweight ABS Molded,MBT,Musical Instruments,Guitars,Classical & Nylon-String Guitars,,213885.0
B0006UZ9PU,Simba Instruments TR-200 Trumpet,,Musical Instruments,Band &amp; Orchestra,Brass,Trumpets,460188.0
B0002L0476,"Fender Dreadnought/GA Series/FR Series/GDO Series/GDC 100 Multi-Fit Hardshell Case, Black",Fender,Musical Instruments,Instrument Accessories,Guitar &amp; Bass Accessories,Bags &amp; Cases,72039.0
B0002H0SS0,Lee Oskar Harmonicas Harmonica (10CP),Lee Oskar Harmonicas,Musical Instruments,Wind & Woodwind Instruments,Folk & World,Harmonicas,113685.0
B0002F4XJM,Tom Crown 30FH - Brass French Horn Transposing Mute,Tom Crown,Musical Instruments,Instrument Accessories,Brass Accessories,Mutes,33092.0
B0002KZV6G,"Fender Eric Clapton Stratocaster, Maple Fretboard - Black",Fender,Musical Instruments,Guitars,Electric Guitars,Solid Body,84785.0
B0002HU8G2,"Rico Graftonite Alto Sax Mouthpiece, A5",D'Addario Woodwinds,Musical Instruments,Instrument Accessories,Wind &amp; Woodwind Accessories,Mouthpieces,115139.0
B0002PSCQ2,Rode K2 Tube Vocal Microphone,Rode,Musical Instruments,Microphones & Accessories,Microphones,Condenser Microphones,65528.0
B0002FOAMC,Latin Percussion LP236D Mount All Bar Chimes Bracket,Latin Percussion,Musical Instruments,Drums & Percussion,Hand Percussion,Hand Bells & Chimes,75521.0
B0002F79N4,Gibraltar SC-STL4 L-Rod Tom Mount Chrome,Gibraltar,Musical Instruments,Instrument Accessories,Drum &amp; Percussion Accessories,Hardware,23891.0
B0002F5E36,Meinl Percussion STB625HH-S 6 1/4-Inch Hand Hammered Steel Cowbell,Meinl Percussion,Musical Instruments,Drums & Percussion,Hand Percussion,Cowbells,118756.0
B0008JGX68,39 Inch Transparent Red Electric Guitar with Carrying Bag and Accessories,,Musical Instruments,Guitars,Electric Guitars,Solid Body,584278.0
B00076WQ4U,Blue Microphones The Shock - Spider Shockmount,Blue,Musical Instruments,Microphones & Accessories,Accessories,Mounts,246399.0
B0002F74AC,Pintech Percussion RS-5 Acoustic Head Trigger,Pintech Percussion,Musical Instruments,Drums & Percussion,Electronic Drums,Triggers,16574.0
B0002MSTJ0,Gibson Special Alloy Humbucker Ultra Light Guitar Strings,Gibson,Musical Instruments,Instrument Accessories,Guitar &amp; Bass Accessories,Strings,384835.0
B00092Q2HY,"Bulb Horn, Straight",Mid-East,Musical Instruments,Band &amp; Orchestra,Brass,,26171.0
B0002WPSGC,Maxam Brass Trumpet,Roger Enterprises,Musical Instruments,Band & Orchestra,Brass,Trumpets,144902.0
B00078NM3W,"Evans ST Dry Drum Head, 14 Inch",Evans,Musical Instruments,Instrument Accessories,Drum &amp; Percussion Accessories,Drum Set Accessories,5629.0
B0002L52QY,Oscar Schmidt AC445 Autoharp Gig Bag,Oscar Schmidt,Musical Instruments,Stringed Instruments,Folk &amp; World,Autoharps,20891.0
B0002F5D8M,"RhythmTech RT1010 Tambourine, Nickel Jingles, Black",Rhythm Tech,Musical Instruments,Drums &amp; Percussion,Hand Percussion,Tambourines,9873.0
B0002F74QQ,"Pearl TH1000S Tom Holder, Uni-Lock System, Short",Pearl,Musical Instruments,Instrument Accessories,Drum & Percussion Accessories,Hardware,223688.0
B0002F741G,Vic Firth American Classic 5A Nylon Drumsticks (5AN),Vic Firth,Musical Instruments,Instrument Accessories,Drum & Percussion Accessories,Drumsticks,1854.0
B0002GFLGA,Remo Putty Pad,Remo,Musical Instruments,Instrument Accessories,Drum &amp; Percussion Accessories,,23441.0
B0002GZV56,Gibraltar SC-PC07 Large Rubber Feet 3/Pack,Gibraltar,Musical Instruments,Instrument Accessories,Drum & Percussion Accessories,,26041.0
B0002F6IWM,Music People  KS7100 Music People KS7100 Table Top Keyboard Stand,THE MUSIC PEOPLE,Musical Instruments,Instrument Accessories,Keyboard Accessories,Stands,504664.0
B0006VX6WM,Digital Reference DR-LVX2 Dynamic Lead Vocal Microphone (Standard),,Musical Instruments,Microphones & Accessories,Microphones,Dynamic Microphones,552357.0
B0002GOBC0,Tech 21 Trademark 60 1x12&quot; Guitar Combo Amplifier,tech21,Musical Instruments,Amplifiers & Effects,Guitar & Bass Amplifiers,Electric Guitar Amplifiers,578309.0
B0006ZP91O,WD Music SSKW 5 Way Switch Knob White,WD Music,Musical Instruments,Instrument Accessories,Guitar & Bass Accessories,Electric Guitar Parts,190038.0
B0002F7KNS,SKB French Horn Case,SKB,Musical Instruments,Instrument Accessories,Brass Accessories,Bags &amp; Cases,58165.0
B00081UX7G,Protec SLIMLINE FLUTE PRO PAC-SKY BLUE,ProTec,Musical Instruments,Instrument Accessories,Wind & Woodwind Accessories,Bags & Cases,507017.0
B0009NSEVA,Mel Bay First Lessons Blues Harmonica Book,Mel Bay,Musical Instruments,Instrument Accessories,General Accessories,,121314.0
B0006OFP0A,Shure FP33 3-Channel Stereo Mixer,Shure,Musical Instruments,Electronic Music, DJ &amp; Karaoke,DJ Equipment,244028.0
B0009DUG02,Intelli IMT-1000 Digital Dual Metronome &amp; Pitch Generator,Intelli,Musical Instruments,Instrument Accessories,General Accessories,Metronomes,44504.0
B0002GOI96,Pro Co 2' Excellines Instrument Cable - 2' Angle-Angle,Pro Co,Musical Instruments,Live Sound & Stage,Stage & Studio Cables,Instrument Cables,109546.0
B0002F58SM,Yamaha YAC-1094P Powder Paper for wind &amp; woodwind musical instruments,Yamaha,Musical Instruments,Instrument Accessories,Wind &amp; Woodwind Accessories,Cleaning &amp; Care,2987.0
B00061ZM0G,"REMO Paddle Drum, FIBERSKYN Head, 8'' Diameter (Includes Mallet And Ball)",Remo,Musical Instruments,Instrument Accessories,Drum & Percussion Accessories,Drumsticks,357573.0
B0002GZYLW,BC Rich BCgc2 Deluxe Multi Fit Guitar Case,B.C. Rich,Musical Instruments,Instrument Accessories,Guitar &amp; Bass Accessories,Bags &amp; Cases,481469.0
B0002EJVL8,Gator G-MIX-B 1212 Padded Nylon Equipment Bag (12&quot; x 11.75&quot; x 5.5&quot;),Gator,Musical Instruments,Studio Recording Equipment,Mixers & Accessories,Accessories,89353.0
B0002F5C6U,Vic Firth Ralph Hardimon Swizzle,Vic Firth,Musical Instruments,Instrument Accessories,Drum &amp; Percussion Accessories,Drumsticks,60786.0
B0002F5DKU,Yamaha MU-TR13C Trumpet Mute Aluminum,Yamaha,Musical Instruments,Instrument Accessories,Brass Accessories,Mutes,153027.0
B0007XGKRW,Sonic Barrier 1&quot; Acoustic Foam w/PSA 18&quot; x 24&quot;,Sonic Barrier,Musical Instruments,Studio Recording Equipment,Studio Environment,Acoustical Treatments,32279.0
B0002L538G,Latin Percussion LP262R Exotic Wood Traditional Clave,Latin Percussion,Musical Instruments,Drums & Percussion,Hand Percussion,Folk & World,119913.0
B0002GLBVO,DiMarzio Model P DP122 Replacement Pickup for Fender P Bass Cream,DiMarzio,Musical Instruments,Instrument Accessories,Guitar & Bass Accessories,Bass Guitar Parts,225203.0
B0002F6SHM,"Lee Oskar Harmonica, Major Key of F Sharp",Lee Oskar Harmonicas,Musical Instruments,Wind & Woodwind Instruments,Folk & World,Harmonicas,53369.0
B0002F5CYC,"Dean Exotica Acoustic-Electric Cutaway Guitar, Trans Blue with Tuner Preamp",Dean Guitars,Musical Instruments,Guitars,Acoustic-Electric Guitars,,505255.0
B0007ZEY96,"Meinl Percussion MIT810CH 8-Inch and 10-Inch Mountable Steel Mini Timbales, Chrome Finish",Meinl Percussion,Musical Instruments,Drums &amp; Percussion,Folk &amp; World Hand Drums,Timbales,151226.0
B0002H0RXQ,Lee Oskar Harmonica Holder - LO10HH,Lee Oskar Harmonicas,Musical Instruments,Wind & Woodwind Instruments,Folk & World,,16769.0
B0002I731Y,Giardinelli Plastic Alto Sax Mouthpiece Cap,Giardinelli,Musical Instruments,Instrument Accessories,Wind &amp; Woodwind Accessories,Parts,164229.0
B0002KZH9C,Fender '65 Deluxe Reverb/Super-Sonic 22 Combo Amplifier Cover - Black,Fender,Musical Instruments,Instrument Accessories,Guitar & Bass Accessories,Amplifier Accessories,11553.0
B0009OXQF8,SONY Soul Jazz Experience ( Windows ),"by
    
    Sony",Musical Instruments,Studio Recording Equipment,Computer Recording,Software,210904.0
B0002MLI70,ART HeadAMP V Headphone  Amplifier - 5 Headphone Channels Level Control,ART,Musical Instruments,Studio Recording Equipment,Mixers & Accessories,Mixers,1150903.0
B0009RTJEC,Industrial Gooseneck Microphone,Speco,Musical Instruments,Microphones & Accessories,Microphones,,26520.0
B0006I5HCC,"RackSolutions 3U 2Post Shelf, Solid, Flanges Down, 29""",RACKSOLUTIONS,Musical Instruments,Studio Recording Equipment,Studio Environment,Rack Accessories,366906.0
B0002GXVYO,Nady ENCORE-1 GT Single Channel VHF Wireless Instrument Microphone System Channel E,Nady,Musical Instruments,Microphones & Accessories,Microphones,Wireless Microphones & Systems,305175.0
B0002FO9RS,Performance Plus GP6P Guitar Pitch Pipe,Performance Plus,Musical Instruments,Instrument Accessories,General Accessories,Tuning,21169.0
B0002MSOQI,Ovation 1616 Phosphor Bronze 12 String Acoustic Guitar Strings (10-47),Adamas Strings,Musical Instruments,Instrument Accessories,Guitar &amp; Bass Accessories,Strings,301327.0
B0002H0D4E,"Guardian CV-013 Deluxe Featherweight Case, 4/4 Size Violin",Guardian Cases,Musical Instruments,Instrument Accessories,Orchestral Strings Accessories,Bags & Cases,252390.0
B0002F6K1G,K &amp; M RAINBOW MUSIC STAND RED,K &amp; M,Musical Instruments,Instrument Accessories,General Accessories,Sheet Music Stands,126430.0
B0002J6I8C,"Remo TA-5210-00 Fiberskyn Tambourine - Quadura White, 10""",Remo,Musical Instruments,Drums &amp; Percussion,Hand Percussion,Tambourines,3320.0
B0002OSBDM,Kun Original 1/4 Violin Shoulder Rest,Kun,Musical Instruments,Instrument Accessories,Orchestral Strings Accessories,Shoulder &amp; Chin Rests,8061.0
B0002L5426,Latin Percussion LP332 LP Percussion Stand,Latin Percussion,Musical Instruments,Instrument Accessories,Drum & Percussion Accessories,Drum Set Accessories,37549.0
B0009G1E0K,"Protec Guitar Strap with Leather Ends and Pick Pocket, Black",ProTec,Musical Instruments,Instrument Accessories,Guitar & Bass Accessories,Straps & Strap Locks,730.0
B0002F5IJ6,Bo-Pep Flute Finger Saddle,Bo-Pep,Musical Instruments,Instrument Accessories,Wind &amp; Woodwind Accessories,Parts,11418.0
B0002H0N6M,"Dean Markley 2035 Acoustic Custom Light Strings, Blue Steel",Dean Markley,Musical Instruments,Instrument Accessories,Guitar &amp; Bass Accessories,Strings,347898.0
B00076XOC8,Astatic GSM-1 Shock Mount Gooseneck Microphone - Superior Isolation,Astatic,Musical Instruments,Microphones & Accessories,Accessories,Mounts,100932.0
B0002GVGPA,"22"" Feng (Wind) Gong",Unknown,Musical Instruments,Drums &amp; Percussion,Drum Sets &amp; Set Components,Gongs,386434.0
B0002L52FA,S/FLEX TRI MIC STAND ADAPTER,Signal Flex,Musical Instruments,Microphones & Accessories,Accessories,,197179.0
B0002JKJ4Q,"Goatskin, 8&quot;, Medium",Mid-East,Musical Instruments,Instrument Accessories,Drum & Percussion Accessories,,1562662.0
B0002F7HBI,Denis Wick DW5881-2B Silver-Plated Cornet Mouthpiece,Denis Wick,Musical Instruments,Instrument Accessories,Brass Accessories,Mouthpieces,169313.0
B0002GFP9S,"Archives Spiral Bound Manuscript Paper Book, 10 Stave, 48 Pages",Archives,Musical Instruments,Instrument Accessories,General Accessories,Staff Boards,34962.0
B0007R2E8W,Star Line Baton Co. Starlet II Twirling Baton,Star Line Baton Co.,Musical Instruments,Instrument Accessories,General Accessories,Conducting,299525.0
B0002GJT9U,"Gibson Gear SEG-SA10 Coated Nickel Electric Guitar Strings, Light",Gibson Gear,Musical Instruments,Instrument Accessories,Guitar &amp; Bass Accessories,Strings,71054.0
B0002GY81O,"Gibson Zakk Wylde Les Paul Electric Guitar, Black/White Bullseye",Gibson,Musical Instruments,Guitars,Electric Guitars,Solid Body,400166.0
B0007XVV94,iStudioLink Microphone - 12 ft. Cable (XLR to 1/8? stereo mini plug) (Discontinued by Manufacturer),Monster,Musical Instruments,Live Sound & Stage,Stage & Studio Cables,Microphone Cables,5409.0
B0002GIRP2,MXL 990 Condenser Microphone with Shockmount,MXL Mics,Musical Instruments,Microphones & Accessories,Microphones,Condenser Microphones,846.0
B0009FC964,Cleartone Electric .009-.042 Super Light Strings,Cleartone Strings,Musical Instruments,Instrument Accessories,Guitar & Bass Accessories,Strings,17915.0
B0002KZIIM,Fender Accessories 099-0507-000 Guitar Tools,Fender,Musical Instruments,Instrument Accessories,Guitar & Bass Accessories,Tools,370442.0
B0002F73XU,Rhythm Band ChromAharP Strings,Rhythm Band,Musical Instruments,Instrument Accessories,Guitar & Bass Accessories,Strings,81611.0
B0008GLGHC,Apple Garageband Jam Pack: Remix Tools,Apple,Musical Instruments,Studio Recording Equipment,Computer Recording,Software,11725.0
B0002GZQ56,DiMarzio DD3100N Nylon Web Guitar Strap Red,DiMarzio,Musical Instruments,Instrument Accessories,Guitar &amp; Bass Accessories,Straps &amp; Strap Locks,588760.0
B0002PEXL0,"Arbor Electric Bass Guitar, AB400 Walnut Stain",Arbor,Musical Instruments,Bass Guitars,Electric Basses,,588462.0
B0002F4MLG,Wuhan WU10420 20-Inch Lion China Cymbal,WUHAN,Musical Instruments,Drums & Percussion,Drum Sets & Set Components,Cymbals,86506.0
B0002ORLXI,Mutec YA3 AC Power Adapter,Mutec,Musical Instruments,Instrument Accessories,Drum &amp; Percussion Accessories,Electronic Drum Accessories,365971.0
B0002F7C9U,Fox Bassoon Reed Case Holds 4 Reeds,Fox,Musical Instruments,Instrument Accessories,Wind & Woodwind Accessories,Reeds,81965.0
B0006ZXF2Y,American Dj M-1Rpm Mirror Ball Motor,American DJ,Musical Instruments,Live Sound &amp; Stage,Lighting Equipment &amp; Accessories,Mirror Balls,6029.0
B0002OQ13O,Atlas MS-43E,Atlas Sound,Musical Instruments,Microphones & Accessories,Accessories,Stands,496105.0
B0002IJECK,Line 6 Spider II 112 Cover,Line 6,Musical Instruments,Instrument Accessories,Guitar & Bass Accessories,Amplifier Accessories,564872.0
B0002GJI0A,MXL 41-603 Microphone Shockmount,MXL Mics,Musical Instruments,Microphones & Accessories,Accessories,Mounts,88898.0
B0002F77PE,Aquarian Drumheads Drumhead Pack (DKP2),Aquarian Drumheads,Musical Instruments,Instrument Accessories,Drum & Percussion Accessories,Drum Set Accessories,1193.0
B0002F534G,Yamaha YAC-1007P Cork Grease,Yamaha,Musical Instruments,Instrument Accessories,Wind &amp; Woodwind Accessories,Cleaning &amp; Care,56025.0
B0009SUUZI,Mighty Bright XtraFlex Super LED Stand Light: Silver,Mighty Bright,Musical Instruments,Instrument Accessories,General Accessories,Stand Lights,142247.0
B0002TUVXK,Leadsinger LS-3C01 Teens 2003 Cartridge for LS-3000 Series Karaoke System (100 Songs),Leadsinger,Musical Instruments,Electronic Music, DJ & Karaoke,Karaoke Equipment,169020.0
B0002Z3B0O,Rogue Learn the Banjo Starter Pack (Standard),,Musical Instruments,Ukuleles, Mandolins & Banjos,Banjos,100203.0
B0002M66OA,Rapco G4-3 3 foot Instrument Cable,Rapco,Musical Instruments,Live Sound &amp; Stage,Stage &amp; Studio Cables,Instrument Cables,552194.0
B0006HY5PI,Ion iED01 Electronic Drum Set with Drum Machine,Ion,Musical Instruments,Drums &amp; Percussion,Electronic Drums,Drum Sets,263870.0
B0006Z4B6I,"D'Addario EPS165 ProSteels Bass Guitar Strings, Custom Light, 45-105, Long Scale",D'Addario,Musical Instruments,Instrument Accessories,Guitar &amp; Bass Accessories,Strings,6621.0
B0002GY86Y,American Dj M-1212 12 Inch Mirror Ball,ADJ Products,Musical Instruments,Live Sound & Stage,Lighting Equipment & Accessories,Mirror Balls,2112.0
B0002MQQ9K,Overseas Connection Mali Djembe 13 in. Natural,Overseas Connection,Musical Instruments,Drums & Percussion,Folk & World Hand Drums,Djembes,319374.0
B0009IC3HQ,banjira Lefty Standard Sitar,banjira,Musical Instruments,Stringed Instruments,Folk & World,Sitars,158945.0
B0002F4TJ6,"Hohner KC 50 Kazoos of Assorted Colors, 50 Pack",Hohner Accordions,Musical Instruments,Wind & Woodwind Instruments,Folk & World,Kazoos,8251.0
B0006ZSU06,GRAPHITE NUT FOR FENDER W/SLOTS,WD Music,Musical Instruments,Instrument Accessories,Guitar & Bass Accessories,Electric Guitar Parts,136555.0
B0008GIZFS,Dean LL EVO Lightweight Case for EVO &amp; Deceiver Model Solid Body Electric Guitars,Dean Guitars,Musical Instruments,Instrument Accessories,Guitar & Bass Accessories,Bags & Cases,257713.0
B0002F5I7I,Giardinelli Silver Trumpet Master Care Pack,Giardinelli,Musical Instruments,Instrument Accessories,Brass Accessories,Cleaning &amp; Care,246865.0
B0002EJVXG,Pearl B200QB Quad Beater,Pearl,Musical Instruments,Instrument Accessories,Drum & Percussion Accessories,,80133.0
B0002GX6XU,MXR M107 Phase 100,JIM DUNLOP,Musical Instruments,Amplifiers & Effects,Guitar Effects,Electric Guitar Effects,26263.0
B0002F6S72,Paiste Signature Cymbal Fast Crash 18-inch,Paiste,Musical Instruments,Drums & Percussion,Drum Sets & Set Components,Cymbals,36221.0
B0002H0B1Y,"G&amp;L Tribute Legacy Guitar (Black, Hard Rock Maple Neck)",G&L Guitars,Musical Instruments,Guitars,Electric Guitars,Solid Body,473943.0
B0002GFODK,DR Strings Hi-Beam - Stainless Steel Round Core 50-110,DR Strings,Musical Instruments,Instrument Accessories,Guitar &amp; Bass Accessories,Strings,60134.0
B0002YXJ20,Ebony Castanets,Lark in the Morning,Musical Instruments,Drums &amp; Percussion,Hand Percussion,Folk &amp; World,581485.0
B0002F6IVI,LMI Transparent Tambourine with Head Blue 15CM,LMI,Musical Instruments,Drums & Percussion,Hand Percussion,Tambourines,53865.0
B0009H76U6,Seymour Duncan TB4 JB Model Trembucker Pickup,Seymour Duncan,Musical Instruments,Instrument Accessories,Guitar &amp; Bass Accessories,Electric Guitar Parts,23258.0
B0002F6IVS,LMI Transparent Tambourine with Head Purple 15CM,LMI,Musical Instruments,Drums & Percussion,Hand Percussion,Tambourines,31002.0
B00079R5SE,Dunlop 919 Stainless Steel Tonebar,JIM DUNLOP,Musical Instruments,Instrument Accessories,Guitar & Bass Accessories,Slides,48178.0
B0006Z4B72,"D'Addario EPS170-5 5-String ProSteels Bass Guitar Strings, Light, 45-130, Long Scale",D'Addario,Musical Instruments,Instrument Accessories,Guitar & Bass Accessories,Strings,6903.0
B0002F6RUA,DIMARZIO DP 188BK Pro Track Black,DiMarzio,Musical Instruments,Instrument Accessories,Guitar &amp; Bass Accessories,Electric Guitar Parts,121288.0
B0002F5BNO,McNally Gig Bag for Grand Strumstick,McNally,Musical Instruments,Instrument Accessories,Orchestral Strings Accessories,Bags & Cases,75437.0
B0002L06CO,RockStand by Warwick RS5 Folding 5-Guitar Stand,RockStand by Warwick,Musical Instruments,Instrument Accessories,Guitar & Bass Accessories,Stands,547090.0
B0002F57XS,Dampit Accordion Accessory (9135),Dampit,Musical Instruments,Instrument Accessories,Orchestral Strings Accessories,Cleaning & Care,26193.0
B0006GWG7I,Fender Passport P80 80-Watt Portable Sound System,Fender,Musical Instruments,Live Sound &amp; Stage,PA Systems,,424204.0
B0009H5VU8,Middle Atlantic VT2 VT Vent Panels,AVBcable.com,Musical Instruments,Studio Recording Equipment,Studio Environment,Rack Accessories,93751.0
B0002F56KM,Vater Percussion Tai Ko Bachi,Vater,Musical Instruments,Instrument Accessories,Drum & Percussion Accessories,Drumsticks,23973.0
B0009V84AS,"Mridangam, South Indian, Bass",banjira,Musical Instruments,Drums & Percussion,Folk & World Hand Drums,Bodhrans & Frame Drums,279577.0
B0002EWRZ0,E. Rousseau New Classic Soprano Sax Mouthpiece NC4,E. Rousseau,Musical Instruments,Instrument Accessories,Wind & Woodwind Accessories,Mouthpieces,194378.0
B0002L537W,Latin Percussion LP402 7 Inch Ice Bell,Latin Percussion,Musical Instruments,Drums & Percussion,Hand Percussion,Hand Bells & Chimes,53015.0
B0002FO9S2,Matrix SR1000 Quarts Tuner Tuner,MATRIX,Musical Instruments,Instrument Accessories,General Accessories,Tuning,107270.0
B0007PENTC,Vocopro 5 Disc DVD/CDG/VCD/MP3/PHOTO CD Karaoke Changer,VocoPro,Musical Instruments,Electronic Music, DJ & Karaoke,Karaoke Equipment,327894.0
B0002FOC2U,"Remo Batter, Crimped, WHITE MAX, 13&quot; Diameter",Remo,Musical Instruments,Instrument Accessories,Drum & Percussion Accessories,Drum Set Accessories,118077.0
B0002F5JF4,Pulse B-2 Tunable 2-Tone Bongos (Standard),,Musical Instruments,Drums & Percussion,Folk & World Hand Drums,Bongos,287389.0
B0002IHFQM,Percussion Plus Bongo Stand,Percussion Pluss,Musical Instruments,Instrument Accessories,Drum &amp; Percussion Accessories,Hardware,239211.0
B0002GOCLK,SKB 1SKB-RLX4 4U Roll-X Rack Case,SKB,Musical Instruments,Studio Recording Equipment,Studio Environment,Racks,197575.0
B0002F7DD0,Leblanc 3057 French Horn Lyre,LE BLANC,Musical Instruments,Instrument Accessories,General Accessories,Music Lyres,104634.0
B0002PBS7M,"Ernie Ball Classic Pure Nickel Regular Slinky Set, .010 - .046",Ernie Ball,Musical Instruments,Instrument Accessories,Guitar & Bass Accessories,Strings,1513.0
B0002NQPHM,SKB 4U Shallow X Rack,SKB,Musical Instruments,Studio Recording Equipment,Studio Environment,Rack Accessories,116747.0
B0002GZK8E,Shure SM87A Vocal Microphone,Shure,Musical Instruments,Microphones & Accessories,Microphones,Condenser Microphones,95296.0
B0009RK7YS,Phonic 31-Band Hand-Held Spectrum Analyzer PAA3,Phonic,Musical Instruments,Studio Recording Equipment,Computer Recording,Audio Interfaces,106306.0
B0007WQTGU,Hal Leonard Disney Greats for Flute Instrumental Play Along Pack Book and CD,Hal Leonard,Musical Instruments,Band & Orchestra,Wind & Woodwinds,Flutes,169796.0
B0002F5CEW,"Nino Percussion NINO600 12 Bar Single Row Chimes, Natural Finish",Nino Percussion,Musical Instruments,Instrument Accessories,Drum & Percussion Accessories,,169779.0
B0002F7EPW,Gibraltar SC-GPR30 30 Inch Straight Rack Tube,Gibraltar,Musical Instruments,Instrument Accessories,Drum &amp; Percussion Accessories,Hardware,42111.0
B0006NMQL2,"Shure A120S In-Line On/Off Switch (No Connectors, Requires Soldering)",Shure,Musical Instruments,Microphones &amp; Accessories,Accessories,,94977.0
B0002GLDQM,Dunlop 5006SI Ergo Pickholder,JIM DUNLOP,Musical Instruments,Instrument Accessories,Guitar &amp; Bass Accessories,Picks &amp; Pick Holders,21821.0
B0002HU8S0,"Vic Firth Elementary Education Pack (includes SD1, M5, M14, BSB)",Vic Firth,Musical Instruments,Drums &amp; Percussion,Folk &amp; World Hand Drums,,56190.0
B0002F73OY,Gibraltar SC-4248 Speed Key,Gibraltar,Musical Instruments,Drums & Percussion,Folk & World Hand Drums,,22558.0
B0002GY17K,Seymour Duncan SFX01 Pickup Booster Guitar/Bass Preamp,Seymour Duncan,Musical Instruments,Instrument Accessories,Guitar & Bass Accessories,Bass Guitar Parts,347657.0
B0002TKJ8C,Premiere Artist Model CF Violin Bow 4/4 Size,Premiere Artist,Musical Instruments,Instrument Accessories,Orchestral Strings Accessories,Bows,369909.0
B0002GO6LQ,Lute Hole Medium Feedback Reducer - Maple,The Lute Hole Company,Musical Instruments,Instrument Accessories,Guitar & Bass Accessories,,159556.0
B0002H0PJM,Epiphone Worn Series G-400 Electric Guitar - Worn Cherry,Epiphone,Musical Instruments,Guitars,Electric Guitars,Solid Body,102682.0
B0002F7KD8,SKB Sculptured Violin 4/4 / 14 Viola,SKB,Musical Instruments,Instrument Accessories,Orchestral Strings Accessories,Bags & Cases,214465.0
B0002PSJ24,Basic Beat String Winder (for Guitar Strings),Basic Beat,Musical Instruments,Instrument Accessories,Guitar &amp; Bass Accessories,String Winders,542539.0
B0002PCOGG,Bamboo Didgeridoo,Lark in the Morning,Musical Instruments,Wind & Woodwind Instruments,Folk & World,Didgeridoos,530626.0
B0007NKU4G,"Dean Banjo Pack with Gig Bag, Strap and Pitch Pipe",Dean Guitars,Musical Instruments,Ukuleles, Mandolins &amp; Banjos,Banjos,48926.0
B0002IHEE0,"REMO Djembe, MONDO, Key-Tuned, 14&quot; x 25&quot;, SKYNDEEP FIBERSKYN, Contour Tuning Brackets, Kintekloth Finish",Remo,Musical Instruments,Drums & Percussion,Folk & World Hand Drums,Djembes,105662.0
B0002M6B36,Martin Acoustic Guitar Bridge Pins (M1600),Martin,Musical Instruments,Instrument Accessories,Guitar & Bass Accessories,Strings,31916.0
B0006V96VM,"5 Starr Super Valve Oil, Clear",5 Starr,Musical Instruments,Instrument Accessories,Brass Accessories,Cleaning & Care,89131.0
B00097BLAC,"D'Addario J75 Mandolin Strings, Phosphor Bronze, Medium/Heavy, 11.5-41",D'Addario,Musical Instruments,Instrument Accessories,Folk & World Instrument Accessories,Mandolin Accessories,46421.0
B0002L529G,Latin Percussion LP511C Solid Concert Bar Chimes(36)Sp,Latin Percussion,Musical Instruments,Drums &amp; Percussion,Hand Percussion,Hand Bells &amp; Chimes,58099.0
B0002F4VU8,Players Products Music Stand (MKHTB-SS),Players,Musical Instruments,Instrument Accessories,Brass Accessories,Cleaning & Care,54528.0
B0002F4TCI,Pearl MFH10 10-Inch Mesh Head,Pearl,Musical Instruments,Instrument Accessories,Drum & Percussion Accessories,Drum Set Accessories,6285.0
B0002PZD50,"Line 6 Spider II 212 Stereo Guitar Combo Amplifier (150 Watts, 2x12 in.)",Line 6,Musical Instruments,Amplifiers & Effects,Guitar & Bass Amplifiers,Electric Guitar Amplifiers,424601.0
B0002GWB22,Music Man Silhouette Special HSS Tremolo Electric Guitar Candy Apple Maple Fretboard,Music Man,Musical Instruments,Guitars,Electric Guitars,Solid Body,526958.0
B0002GVKU6,Basic Beat 15&quot; Slapstick,Basic Beat,Musical Instruments,Drums & Percussion,Hand Percussion,,51468.0
