asin,title,brand,main_category,second_category,third_category,fourth_category,rank
B0002GJ4AY,"Dunlop 41P1.5 Delrin, Lavender, 1.5mm, 12/Player's Pack",JIM DUNLOP,Musical Instruments,Instrument Accessories,Guitar & Bass Accessories,Picks & Pick Holders,9782.0
B0002IHFHQ,Herco HE106 Clarinet Composition Maintenance Kit,Herco,Musical Instruments,Instrument Accessories,Wind &amp; Woodwind Accessories,Cleaning &amp; Care,23711.0
B0002F7KRE,"Remo Ocean Drum - Fish Graphic, 12&quot;",Remo,Musical Instruments,Drums & Percussion,Folk & World Hand Drums,Ocean Drums,24240.0
B0002GJ56M,"Wedgie WDPP73 0.73mm Wedgie Delrin Pick, 12 Pack, Yellow",Wedgie,Musical Instruments,Instrument Accessories,Guitar & Bass Accessories,Picks & Pick Holders,201915.0
B00065Q47W,Hal Leonard Disney Blockbusters - Easy Piano Play-Along Volume 11,Hal Leonard,Musical Instruments,Instrument Accessories,General Accessories,,222956.0
B0009G0AZ0,"D'Addario ECB81SL Chromes Bass Guitar Strings, Light, 45-100, Super Long Scale",D'Addario,Musical Instruments,Instrument Accessories,Guitar & Bass Accessories,Strings,96212.0
B0002F52WO,Latin Percussion LP Matador 11&quot; Fiberglass Quinto - Black/Chrome,Latin Percussion,Musical Instruments,Drums & Percussion,Folk & World Hand Drums,Congas,297715.0
B0006ZNAEC,METAL STRAT PICKUP MOUNTING RING GOLD,WD Music,Musical Instruments,Instrument Accessories,Guitar & Bass Accessories,Electric Guitar Parts,204224.0
B0002H0SJO,"DR Strings Electric Guitar Strings, Hi-Beam, Hex Core 12-52",DR Strings,Musical Instruments,Guitars,,,102924.0
B0006ZXFZQ,MXR M133 Micro Amp,MXR,Musical Instruments,Amplifiers & Effects,Guitar Effects,Electric Guitar Effects,10806.0
B0002TKJ7S,Line 6 FBV Bag,Line 6,Musical Instruments,Instrument Accessories,Guitar & Bass Accessories,Amplifier Accessories,257969.0
B0002F7H0E,Johnson Hawaiian Soprano Ukulele,Johnson,Musical Instruments,Ukuleles, Mandolins &amp; Banjos,Ukuleles,238052.0
B0002II8H2,Ludwig 900 Series Modular Double Braced/Low Profile Snare Drum Stand (LM922SSL),Ludwig,Musical Instruments,Instrument Accessories,General Accessories,,486678.0
B0002OOMUS,Dunlop 7006J Ergo Lock (1 Piece),JIM DUNLOP,Musical Instruments,Instrument Accessories,Guitar & Bass Accessories,Straps & Strap Locks,401870.0
B0002F4VLW,2438 Alto Saxophone Reed Guard,Vito,Musical Instruments,Instrument Accessories,Wind & Woodwind Accessories,Reeds,106069.0
B00075VQRO,Shure A15HP High Pass Filter,Shure,Musical Instruments,Live Sound &amp; Stage,Stage &amp; Studio Cables,,48002.0
B0002ZPK30,Parts Express ST-140 ST-G13 Sanyo Type Replacement Stylus Needle,Parts Express,Musical Instruments,Electronic Music, DJ & Karaoke,DJ Equipment,124669.0
B0002F588W,ATTACK TBVP Terry Bozzio ValuePack Percussion Effect,Attack Drumheads,Musical Instruments,Drums & Percussion,Hand Percussion,Sound Effects,54671.0
B0002HU8IU,"Rico Graftonite Baritone Sax Mouthpiece, B5",D'Addario Woodwinds,Musical Instruments,Instrument Accessories,Wind &amp; Woodwind Accessories,Mouthpieces,37111.0
B0002F6PKC,"Epiphone EJ-200SCE Solid Top Cutaway Acoustic / Electric Guitar, Black",Epiphone,Musical Instruments,Guitars,Electric Guitars,Solid Body,81214.0
B0007U88XY,Armenian Duduk,DUDUK.COM,Musical Instruments,Band & Orchestra,Wind & Woodwinds,,593457.0
B0002GZUYI,Dean HS B Hardshell Case for Banjos,Dean Guitars,Musical Instruments,Ukuleles, Mandolins & Banjos,Banjos,85974.0
B0002F6UQ6,Belmonte Standing Sax Stand,Belmonte,Musical Instruments,Instrument Accessories,Wind & Woodwind Accessories,Stands,438934.0
B0002TUVXU,Leadsinger LS-3222 Duet Microphone for LS-3700 All-in-One Karaoke System,Leadsinger,Musical Instruments,Microphones & Accessories,Microphones,Dynamic Microphones,240351.0
B0002TKKTA,The String Centre Millant Deroux Rosin Dark,The String Centre,Musical Instruments,Instrument Accessories,Orchestral Strings Accessories,Rosin,190584.0
B0007VJ7EW,M-Audio Keystation 49E / Transit Bundle,M-Audio,Musical Instruments,Studio Recording Equipment,Computer Recording,MIDI Controllers,580794.0
B0006MOOXG,Bellafina Thermoplastic Violin Case 1/10 Size,Bellafina,Musical Instruments,Instrument Accessories,Orchestral Strings Accessories,Bags &amp; Cases,484623.0
B0002F4M66,SuperSlick HSWAB Clarinet/Flute Hanky Swab (colors may vary),SuperSlick,Musical Instruments,Instrument Accessories,Wind & Woodwind Accessories,Cleaning & Care,12115.0
B0002GU1ME,Nady TD-1 Classic Tube Distortion Foot Pedal,Nady,Musical Instruments,Amplifiers & Effects,Guitar Effects,Electric Guitar Effects,224042.0
B0002IL4TG,"Conn-Selmer, Inc. 2439 Bass Clarinet/Tenor Sax Reed Guard Reed Case","Conn-Selmer, Inc.",Musical Instruments,Instrument Accessories,Wind &amp; Woodwind Accessories,Parts,66286.0
B0002Q0JYO,"D'Addario Prelude Viola Single A String, Short Scale, Medium Tension",D'Addario,Musical Instruments,Instrument Accessories,Orchestral Strings Accessories,Strings,110133.0
B0006ZUZUO,Humes &amp; Berg TX489 8 X 10-Inches Tuxedo Tom Drum Bag,Humes & Berg,Musical Instruments,Instrument Accessories,Drum & Percussion Accessories,Bags,236803.0
B0006GBC00,LP RhythMix X-Drum with Drumstick,Latin Percussion,Musical Instruments,Instrument Accessories,Drum &amp; Percussion Accessories,Drumsticks,163325.0
B0002U8B6S,Grizzly H5961 Guitar Stand-Acoustic,Grizzly,Musical Instruments,Guitars,,,257487.0
B0002H013C,"Gibson Gear IM59B-NH Burstbucker Pro Bridge, Nickel",Gibson Gear,Musical Instruments,Instrument Accessories,Guitar & Bass Accessories,Electric Guitar Parts,174555.0
B00084VKH0,HW Products Percussion Bar (T8HLS),HW,Musical Instruments,Drums & Percussion,Hand Percussion,,15426.0
B0002EJOEC,Selmer Paris Super Session Soprano Saxophone Mouthpiece Model H,Selmer Paris,Musical Instruments,Instrument Accessories,Wind & Woodwind Accessories,Mouthpieces,168941.0
B0002KZHCE,"Fender Champ 110, Vibro Champ Xd, Super Champ Xd, G-Dec 30, Fronan 25R Cover",Fender,Musical Instruments,Instrument Accessories,Guitar &amp; Bass Accessories,Amplifier Accessories,33088.0
B0002FOO8W,AMERICAN PLATING 597G Lyre Holder Screw Gold,American Plating,Musical Instruments,Instrument Accessories,General Accessories,,176532.0
B0002FO8BK,DR Strings Lo-Rider - Stainless Steel Hex Core Bass 45-105,DR Strings,Musical Instruments,Instrument Accessories,Guitar & Bass Accessories,Strings,21856.0
B0007Y5OMI,"Meinl Percussion CAJ1SNTM Meinl CAJ1SNT-M Snare Cajon, Frontplate, American White Ash",Meinl Percussion,Musical Instruments,Drums &amp; Percussion,Hand Percussion,Folk &amp; World,86491.0
B0007XOTQ6,HW Products HW Pad-Saver for Piccolo (H-PIC),HW,Musical Instruments,Instrument Accessories,Wind & Woodwind Accessories,Cleaning & Care,38248.0
B0009JIIB0,Mackie Tracktion 2 Digital Audio Software,Mackie,Musical Instruments,Studio Recording Equipment,Computer Recording,Software,573408.0
B0002F7INK,On-Stage Stands Double Saxophone Stand with Two Pegs,OnStage,Musical Instruments,Instrument Accessories,Wind & Woodwind Accessories,Stands,127720.0
B0002GLF2Y,Zildjian A Series 16&quot; Rock Crash Cymbal,Avedis Zildjian Company,Musical Instruments,Drums & Percussion,Drum Sets & Set Components,Cymbals,158515.0
B0006HGYCU,Galaxy Cricket Polarity Test Set,Galaxy,Musical Instruments,Live Sound &amp; Stage,Stage &amp; Studio Cables,,18081.0
B00065PWMA,Hal Leonard Rubank Supplementary Studies for Trombone,Hal Leonard,Musical Instruments,Band &amp; Orchestra,Brass,,282312.0
B0002H0SUS,"DR Strings Bass Strings, Bootzillas - Bootsy Collins Signature Coated, 45-105",DR Strings,Musical Instruments,Instrument Accessories,Guitar &amp; Bass Accessories,Strings,12153.0
B0002FP030,Gibraltar SC-STL2 Super L-Rod Tom Mount Key Tighten,Gibraltar,Musical Instruments,Instrument Accessories,Drum & Percussion Accessories,,162949.0
B00094OWK6,U.S. Robotics Wireless MAXg PC Card (USR5411),USRobotics,Musical Instruments,Microphones & Accessories,Microphones,,17900.0
B0002F4WC0,Nady SSM-3 - Shock Mount for Nady SCM 900/910/920/1000 and TCM 1000 studio microphones,Nady,Musical Instruments,Microphones & Accessories,Accessories,Mounts,57504.0
B0002GO1JI,Ampwedge Polyurethane Amplifier Isolation Floor Wedge,AmpWedge,Musical Instruments,Instrument Accessories,Guitar & Bass Accessories,Amplifier Accessories,56379.0
B0007XX28M,Humes &amp; Berg Stonelined Cup Flugelhorn Mute (186),Humes & Berg,Musical Instruments,Instrument Accessories,Brass Accessories,Mutes,131416.0
B0002GFQ2O,Selmer Accordion Accessory (337RC),SELMER,Musical Instruments,Instrument Accessories,Brass Accessories,Cleaning & Care,2961.0
B0002F7JZ2,Epiphone Case for Epiphone Banjo,Epiphone,Musical Instruments,Instrument Accessories,Folk & World Instrument Accessories,Banjo Accessories,147843.0
B0002INL56,"Shure WL50W Professional Subminiature Lavalier Microphones, White, standard sensitivity, 5-ft attached cable with TA4F connector",Shure,Musical Instruments,Microphones &amp; Accessories,Microphones,Wireless Microphones &amp; Systems,472959.0
B0006GVNQS,Waltons Guinness Tin Whistle Package,Guinness,Musical Instruments,Wind &amp; Woodwind Instruments,Folk &amp; World,Whistles,63277.0
B0002HA7M2,Zildjian Weekender Bag,Avedis Zildjian Company,Musical Instruments,Instrument Accessories,General Accessories,,128543.0
B0006GEYX2,Pyle PYD1270 12-Channel 2-BUS Mixing Console,Pyle,Musical Instruments,Studio Recording Equipment,Mixers &amp; Accessories,Mixers,181724.0
B0002WSVZM,Zoom 15 Watt Fire Amplifier,Zoom,Musical Instruments,Amplifiers &amp; Effects,Guitar &amp; Bass Amplifiers,Electric Guitar Amplifiers,585865.0
B0002M0VRI,Whirlwind DIRECT2 Dual Direct Box,Whirlwind,Musical Instruments,Studio Recording Equipment,Signal Processors,Direct Boxes,70191.0
B0002GXRHU,Traynor YCV20WR Guitar Amp in Wine Red,Traynor,Musical Instruments,Amplifiers & Effects,Guitar & Bass Amplifiers,Electric Guitar Amplifiers,515750.0
B0006J79ZO,Column Keyboard Stand,Ultimate,Musical Instruments,Instrument Accessories,Keyboard Accessories,Stands,257593.0
B0002GNT28,Rotosond Stainless Steel Roundwound Bass Guitar Strings,ROTOSOUND,Musical Instruments,Instrument Accessories,Guitar &amp; Bass Accessories,Strings,72283.0
B0007XYZNS,Humes &amp; Berg 132 Trumpet Mute,Humes &amp; Berg,Musical Instruments,Instrument Accessories,Brass Accessories,Mutes,74053.0
B0002FOAXG,"REMO Tambourine, Economy, 6&quot; Diameter, 6 Pairs Jingles x 1 Row, QUADURA Black",Remo,Musical Instruments,Drums & Percussion,Hand Percussion,Tambourines,31540.0
B0002HSLE8,Lark's Ebony Irish Flute,Lark in the Morning,Musical Instruments,Band &amp; Orchestra,Wind &amp; Woodwinds,Flutes,597310.0
B0006MOOW2,Bellafina Thermoplastic Violin Case 3/4 Size,Bellafina,Musical Instruments,Instrument Accessories,Orchestral Strings Accessories,Bags &amp; Cases,185649.0
B0002LDFIQ,"Innovative Percussion SOLOIST SERIES MEDIUM HARD LEGATO, IP300 Medium Hard",Innovative Percussion,Musical Instruments,Instrument Accessories,Drum & Percussion Accessories,Drumsticks,55866.0
B00079HYZ8,Promark JSB6 Jumbo Stick Bag,Promark,Musical Instruments,Instrument Accessories,Drum &amp; Percussion Accessories,Bags,185465.0
B0002GZZPW,Danelectro DJ-17C Delay Mini Effects Pedal,Danelectro,Musical Instruments,Amplifiers & Effects,Guitar Effects,Electric Guitar Effects,160555.0
B0009V840I,"Devil Chasers, pair",Mid-East,Musical Instruments,Drums & Percussion,Hand Percussion,Sound Effects,166856.0
B0007ZHWXQ,Latin Percussion LP333 Scraper,Latin Percussion,Musical Instruments,Drums & Percussion,Hand Percussion,Folk & World,33611.0
B0002EJNH0,Selmer Cork Grease (Tube),SELMER,Musical Instruments,Instrument Accessories,Wind & Woodwind Accessories,,16947.0
B0002GY7LA,"Gibson Les Paul Custom Electric Guitar, Ebony",Gibson,Musical Instruments,Guitars,Electric Guitars,Solid Body,193098.0
B00098FKUS,Humes &amp; Berg Stonelined SH! SH! Practice Bass Trombone Mute (178),Humes & Berg,Musical Instruments,Instrument Accessories,Brass Accessories,Mutes,311157.0
B0002F56KW,Vater Acoustick Poly/Wood Multi Rod Sticks (VMAS),Vater,Musical Instruments,Instrument Accessories,Drum & Percussion Accessories,Drumsticks,41527.0
B0002F5E18,"Meinl &quot;The Night&quot; Chirping Cricket Percussion Sound Effect - NOT MADE IN CHINA - Amber Wooden Body with Steel Cylinder and Balls, 2-YEAR WARRANTY (NI1AM)",Meinl Percussion,Musical Instruments,Drums & Percussion,Hand Percussion,Sound Effects,107494.0
B00075Q5HK,American Dj Scene Setter 24 Channel Conventional Dimmer Controller,ADJ Products,Musical Instruments,Live Sound & Stage,Lighting Equipment & Accessories,Lighting Accessories,80555.0
B0002I8Z3O,Mini-Conga Set,Latin Groove,Musical Instruments,Drums &amp; Percussion,Folk &amp; World Hand Drums,Congas,541268.0
B0007Y7EPS,Jo Ral 472764902 Grime Gutter Cornet Flugel Trumpet,JoRal,Musical Instruments,Instrument Accessories,Brass Accessories,Cleaning & Care,52680.0
B0007TYPXW,Seymour Duncan Everything Axe Strat Set Electric Guitar Electronics,Seymour Duncan,Musical Instruments,Instrument Accessories,Guitar & Bass Accessories,Electric Guitar Parts,132239.0
B0002IHG0C,"Remo Tar-Rine, 12"" x 2-5/8"", Fixed RENAISSANCE, German Silver Jingle, 10 Pairs x 2 Rows, Venwood, Aqua, Layne Redmond",Remo,Musical Instruments,Drums &amp; Percussion,Hand Percussion,Tambourines,176832.0
B0002KZTAY,"Fender American Vintage '62 Precision Bass, 3 Tone Sunburst, Rosewood Fretboard",Fender,Musical Instruments,Guitars,Electric Guitars,Solid Body,483402.0
B0002FOECS,Gard Deluxe Alto Sax Gig Bag High Grade Leather,Gard,Musical Instruments,Instrument Accessories,Wind & Woodwind Accessories,Bags & Cases,241226.0
B00062IICE,Line 6 CrunchTone,Line 6,Musical Instruments,Amplifiers & Effects,Guitar Effects,Electric Guitar Effects,373335.0
B0002Z2C90,"Wedgie WRPP50M 5.0mm Medium Wedgie Rubber Pick, 3 Pack",Wedgie,Musical Instruments,Instrument Accessories,Guitar & Bass Accessories,Picks & Pick Holders,45938.0
B0002GJKIK,"Dunlop 474R3.0 Stubby, Dark Purple, 3.0mm, 24/Bag",JIM DUNLOP,Musical Instruments,Instrument Accessories,Guitar &amp; Bass Accessories,,56661.0
B0002F55MQ,Yamaha YAC TR15E4 Standard Series Mouthpiece for Trumpet - 15E4,Yamaha,Musical Instruments,Instrument Accessories,Brass Accessories,Mouthpieces,158508.0
B0002F5G6Q,TreeWorks Chimes LG24 Large Soft-Sided Gig Bag and Transport Case for Wind Chimes or Bar Chimes up to 24&quot;,TreeWorks Chimes,Musical Instruments,Instrument Accessories,Drum & Percussion Accessories,Bags,89539.0
B0002F5IYG,Zildjian SMNN  Session Master Nylon Tip Drumsticks,Avedis Zildjian Company,Musical Instruments,Instrument Accessories,Drum & Percussion Accessories,Drumsticks,272263.0
B0002ORP8O,Samson BT4 Telescoping Boom Stand,Samson Technologies,Musical Instruments,Microphones & Accessories,Accessories,Stands,70670.0
B0002F6VTW,Gibraltar SC-19A Long Flanged Cymbal Sleeve4/Pack,Gibraltar,Musical Instruments,Instrument Accessories,Drum & Percussion Accessories,Drum Set Accessories,24384.0
B0002KZE7C,Fender Pickguard Screws,Fender,Musical Instruments,Instrument Accessories,Guitar & Bass Accessories,Electric Guitar Parts,547.0
B0002I73PU,"B.C. Rich Warlock Electric Guitar, Black",B.C. Rich,Musical Instruments,Guitars,Electric Guitars,Solid Body,93901.0
B0002GUGQK,"Hughes &amp; Kettner FS1 Footswitch for Vortex, Metroverb, and Club Reverb",Hughes & Kettner,Musical Instruments,Amplifiers & Effects,Guitar & Bass Amplifiers,Electric Guitar Amplifiers,242019.0
B0009JR9UG,Kun Collapsible 3/4-1/2 Violin Shoulder Rest,Kun,Musical Instruments,Instrument Accessories,Orchestral Strings Accessories,Shoulder & Chin Rests,6861.0
B0009N5BPC,"Dean Markley NickelSteel Signature Bass Guitar Strings, 40-100, 2602A, Light",Dean Markley,Musical Instruments,Instrument Accessories,Guitar &amp; Bass Accessories,Strings,170210.0
B0002F78TE,Yamaha Digital String Instrument Tuner,Yamaha,Musical Instruments,Instrument Accessories,General Accessories,Tuning,229846.0
B0006ZNBZK,P90 PICKUP (HUM. RETROFIT) GOLD RW/RP,Kent Armstrong,Musical Instruments,Instrument Accessories,Guitar &amp; Bass Accessories,Electric Guitar Parts,542903.0
B0002F6ZAM,GHS 4-String Bass Brite Flats 34&quot;-35&quot; 49-108 M3075,Ghs,Musical Instruments,Instrument Accessories,Guitar & Bass Accessories,Strings,165467.0
B0002F6QCO,YSL354 Trombone,Yamaha,Musical Instruments,Band & Orchestra,Brass,Trombones,130897.0
B0002EJNFC,"Vater 3A Wood Tip Hickory Drum Sticks, Pair",Vater,Musical Instruments,Instrument Accessories,Drum & Percussion Accessories,Drumsticks,37560.0
B0002F57EM,Seymour Duncan SCR-1b Cool Rails Strat Pickup - White Bridge,Seymour Duncan,Musical Instruments,Instrument Accessories,Guitar & Bass Accessories,Electric Guitar Parts,178281.0
B0002H013M,Gibson Gear IM59A-NH Electric Guitar Electronics,Gibson Gear,Musical Instruments,Guitars,,,232952.0
B0002F78OY,Gibraltar SC-GPRML Power Rack Memory Lock 2/Pack,Gibraltar,Musical Instruments,Instrument Accessories,Drum & Percussion Accessories,Hardware,16861.0
B0002M71SA,Sovtek 5Y3GT Vacuum Tube,Sovtek,Musical Instruments,Instrument Accessories,Guitar & Bass Accessories,Amplifier Accessories,40662.0
B0002LD19O,Solfege Hand Signs Banner,"IRIS USA, Inc.",Musical Instruments,Instrument Accessories,General Accessories,,269744.0
B0002GYYEA,Digitech XBS Bass Multi-Band Compressor Pedal,DigiTech,Musical Instruments,Amplifiers &amp; Effects,Guitar Effects,Bass Guitar Effects,165859.0
B0002H07CW,Electro-Harmonix 9V Power Supply (Standard),Electro-Harmonix,Musical Instruments,Instrument Accessories,Guitar &amp; Bass Accessories,,20829.0
B0002KX0JQ,Barrington Model BR TR210S Bb Silver Plated Standard Trumpet w/Monel Pistons,Barrington,Musical Instruments,Band &amp; Orchestra,Brass,Trumpets,216237.0
B0007PR7FY,Jo-Ral TPT-6 Aluminum Trumpet Plunger Mute,JoRal,Musical Instruments,Instrument Accessories,Brass Accessories,Mutes,139847.0
B00078BO8W,Shure WA570A Neoprene Bodypack Belt Pouch for Wireless Bodypack Transmitters - Ideal for Fitness Instructors,Shure,Musical Instruments,Live Sound &amp; Stage,Bags &amp; Cases,,11769.0
B0002H0OCA,Dean Markley Alchemy GoldPhosphor CL 2045 Acoustic Guitar Strings (.012-.054),Dean Markley,Musical Instruments,Instrument Accessories,Guitar & Bass Accessories,Strings,301419.0
B0002JEUZA,"Shure RK183T1 Single Mount Tie-Clips for MX183, MX184, MX185, WL183, WL184, and WL185, Set of 2",Shure,Musical Instruments,Microphones & Accessories,Microphones,,37732.0
B0002EKJVY,"Pearl P2000C Eliminator Single Bass Drum Pedal, Chain Drive",Pearl,Musical Instruments,Instrument Accessories,Drum & Percussion Accessories,Drum Set Accessories,109839.0
B0002GZSR2,Shure BETA 98H/C Clip-On Cardioid Condenser Microphone for Sax/Brass with Integrated Shock Mount and Attached Preamplifier (XLR),Shure,Musical Instruments,Microphones & Accessories,Microphones,Dynamic Microphones,39561.0
B0002H0SYE,Sennheiser E604 Dynamic Cardioid for Snare and Toms,Sennheiser,Musical Instruments,Microphones & Accessories,Microphones,Dynamic Microphones,13368.0
B0002L527I,LP LP290B Double Conga Stand,Latin Percussion,Musical Instruments,Drums & Percussion,,,16377.0
B0002I9QA0,"Vic Firth American Custom Keyboard, Poly Ball Soft",Vic Firth,Musical Instruments,Instrument Accessories,Drum &amp; Percussion Accessories,Drumsticks,75999.0
B0002GTZOO,Rogue P8 Bulk 12 Pack 008 Plain Steel Electric Guitar Strings,Rogue,Musical Instruments,Instrument Accessories,Guitar &amp; Bass Accessories,Strings,47107.0
B000622AD2,Yamaha PSR-295MS Portable 61-Key Touch-Sensitive Electronic Keyboard with Adapter and Stand,Yamaha,Musical Instruments,Keyboards & MIDI,Electronic Keyboards,Portable Keyboards,461013.0
B0002F7146,Gibraltar SC-JPM Jaw Percussion Mount,Gibraltar,Musical Instruments,Instrument Accessories,Drum & Percussion Accessories,Hardware,142697.0
B0009V8YZS,Promark Tubz,Promark,Musical Instruments,Instrument Accessories,Drum & Percussion Accessories,Drumsticks,44771.0
B0002H06KU,Gibraltar SC-670TB Tom Bracket Single 7/8 Inch Hole,Gibraltar,Musical Instruments,Instrument Accessories,Drum &amp; Percussion Accessories,Hardware,37529.0
B0002ZO3Z6,Pearl PSC30 Spirit Chimes,Pearl,Musical Instruments,Drums &amp; Percussion,Hand Percussion,Hand Bells &amp; Chimes,201736.0
B0002EWU7K,Rhythm Band Large Superball Mallets,Rhythm Band,Musical Instruments,Instrument Accessories,Drum & Percussion Accessories,Drumsticks,12723.0
B0009PKOUW,"Strauss Pernambuco Violin Bow, Full-line",Strauss,Musical Instruments,Instrument Accessories,Orchestral Strings Accessories,Bows,567166.0
B00068DA9E,"Shure SLX24/BETA87A Handheld Wireless System, H5",Shure,Musical Instruments,Microphones & Accessories,Microphones,Wireless Microphones & Systems,125447.0
B0002H0MQS,Voodoo Lab GCX True Bypass 8-Loop Rackmount Audio Switcher,Voodoo Lab,Musical Instruments,Amplifiers &amp; Effects,Guitar &amp; Bass Amplifiers,Electric Guitar Amplifiers,112934.0
B0009V84B2,"Spare Bodhran Goatskin Head, 18&quot;",Mid-East,Musical Instruments,Drums & Percussion,Folk & World Hand Drums,Bodhrans & Frame Drums,207276.0
B0002F7J3O,Remo FA1522-00 22-Inch Fiberskyn 3 Ambassador Bass Drum Head,Remo,Musical Instruments,Drums & Percussion,Drum Sets & Set Components,Drums,41607.0
B0002FOE32,"Rico Grand Concert Select Tenor Sax Reeds, Strength 2.5, 5-pack",D'Addario Woodwinds,Musical Instruments,Instrument Accessories,Wind & Woodwind Accessories,Reeds,29258.0
B0002GO864,"SKB ATA Rated, Electric Bass Safe with Wheels (Hard Clamshell Design for Use with GigBag)",SKB,Musical Instruments,Instrument Accessories,Guitar &amp; Bass Accessories,Bags &amp; Cases,73834.0
B0002F7C5Y,Yamaha Simulated Rosewood 300-Series 3-Piece C-Soprano Recorder,Yamaha,Musical Instruments,Band &amp; Orchestra,Wind &amp; Woodwinds,Recorders,195464.0
B0009HN574,Sibelius Student Edition,Sibelius,Musical Instruments,Studio Recording Equipment,Computer Recording,Software,4870.0
B0002F6J4E,"Musician 's Gear Hickory 20-Pack, Assorted Colors and Styles",Musician's Gear,Musical Instruments,Instrument Accessories,Drum & Percussion Accessories,Drumsticks,10729.0
B0002M6TEM,Pirastro Obligato 4/4 Cello String Set,Pirastro,Musical Instruments,Instrument Accessories,Orchestral Strings Accessories,Strings,119285.0
B0002H0NQC,Dean Markley 2068A Markley Strngs Phos Brnz Med,Dean Markley,Musical Instruments,Instrument Accessories,Guitar & Bass Accessories,Strings,146251.0
B0002F74GG,Gibraltar SC-SLRM Medium Single L-Rod Mount 10.5Mm,Gibraltar,Musical Instruments,Instrument Accessories,Drum & Percussion Accessories,Hardware,33552.0
B0007KU9YA,"Levy's Leathers M7GP-BRN 2"" Garment Leather Guitar Strap, Brown",Levy's Leathers,Musical Instruments,Instrument Accessories,Guitar &amp; Bass Accessories,Straps &amp; Strap Locks,49434.0
B0007Y5OLE,"Meinl Percussion IBO Drum, Large Fiberglass Body with Additional Circular Playing Surface-NOT Made in China-Includes Microphone Port and Padded Foam Base, 2-Year Warranty, Black (ID4BKO)",Meinl Percussion,Musical Instruments,Drums & Percussion,Folk & World Hand Drums,Udu Drums,61551.0
B0002GJHYM,MXL Mics MXL-90 Microphone Shock Mount for 770/990,MXL Mics,Musical Instruments,Microphones &amp; Accessories,Microphones,Condenser Microphones,5613.0
B0002ORMI2,Protec LEATHER BOW QUIVER,ProTec,Musical Instruments,Instrument Accessories,Orchestral Strings Accessories,Bows,31105.0
B0007YBXX2,Erne Ball # 1124 Custom Gauge 24W Nickel Wound---ONE STRING,Ernie Ball,Musical Instruments,Instrument Accessories,Guitar &amp; Bass Accessories,Strings,448329.0
B00066UN4G,Vic Firth Rute 202,Vic Firth,Musical Instruments,Instrument Accessories,Drum &amp; Percussion Accessories,Drumsticks,70997.0
B0006ZUZRM,"Levy's Leathers 2&quot; Polyester Guitar Strap with Printed Design, Garment Leather Ends and Tri-glide Adjustment (MP-18)",Levy's Leathers,Musical Instruments,Instrument Accessories,Guitar & Bass Accessories,Straps & Strap Locks,82964.0
B0002F52E2,Latin Percussion Santana Supernatural Mini Conga (Purple),Latin Percussion,Musical Instruments,Drums & Percussion,Folk & World Hand Drums,Congas,113981.0
B0002GDJ7S,Zildjian K Custom 16&quot; Fast Crash Cymbal,Avedis Zildjian Company,Musical Instruments,Drums & Percussion,Drum Sets & Set Components,Cymbals,148911.0
B0002F5FXA,Protection Racket 5047W-01 Large Rolling Hardware Bag,PROTECTIONracket,Musical Instruments,Instrument Accessories,Drum &amp; Percussion Accessories,Bags,86415.0
B0002F4ZN6,Vic Firth American Classic Extreme 5B (X5B) Drumsticks,Vic Firth,Musical Instruments,Instrument Accessories,Drum & Percussion Accessories,Drumsticks,24905.0
B0002MDTSG,Recorder Pack: Yamaha Pink Soprano Recorder with Do It! Play Recorder! Book &amp; CD,Yamaha,Musical Instruments,Band & Orchestra,Wind & Woodwinds,Recorders,103676.0
B0002F58YQ,Gemeinhardt Flute Cleaning Kit,Gemeinhardt,Musical Instruments,Instrument Accessories,Wind &amp; Woodwind Accessories,Cleaning &amp; Care,21259.0
B0002GH8LQ,MIDI Solutions 2-input MIDI Merger,MIDI Solutions,Musical Instruments,Studio Recording Equipment,Computer Recording,MIDI Interfaces,25557.0
B0002GTZR6,Dunlop D3811BL Flambe Blue Strap,JIM DUNLOP,Musical Instruments,Instrument Accessories,Guitar & Bass Accessories,Straps & Strap Locks,24385.0
B0002M6AIC,"D&rsquo;Addario Woodwinds Hemke Tenor Sax Reeds, Strength 2.0, 5-pack - RHKP5TSX200",D'Addario Woodwinds,Musical Instruments,Instrument Accessories,Wind & Woodwind Accessories,Ligatures,43965.0
B0002ZO3L0,Zildjian ZBT 4 Cymbal Set Up Pack,Avedis Zildjian Company,Musical Instruments,Drums & Percussion,Drum Sets & Set Components,Cymbals,386216.0
B0006MON14,Rhythm Band Steel Cowbell 4.5,Rhythm Band,Musical Instruments,Drums &amp; Percussion,Drum Sets &amp; Set Components,Bells &amp; Chimes,11705.0
B00030ASYU,Leadsinger LS-3C11 Classic Rock B Cartridge for LS-3000 Series Karaoke System (200 Songs),Leadsinger,Musical Instruments,Electronic Music, DJ & Karaoke,Karaoke Equipment,133365.0
B0006ZP950,"Schaller Chrome Straplocks, Pair",Schaller,Musical Instruments,Instrument Accessories,Guitar &amp; Bass Accessories,Straps &amp; Strap Locks,153904.0
