asin,title,brand,main_category,second_category,third_category,fourth_category,rank
B0002WSK8A,Lauren LA100C 39-Inch Full-Size Nylon String Classical Acoustic Guitar - Natural,Lauren,Musical Instruments,Guitars,Classical &amp; Nylon-String Guitars,,124391.0
B0002FOHTI,Jones JR101MS Oboe Reed; Medium Soft,Jones,Musical Instruments,Instrument Accessories,Wind & Woodwind Accessories,Reeds,2949.0
B0002F6K4S,S Series Splash Cymbals 10 inch,,Musical Instruments,Drums & Percussion,Drum Sets & Set Components,Cymbals,524988.0
B00061UJBI,"Pro Co 3' IPBQ2Q-3, 1/4"" TRS to (2) 1/4"" TS Insert Cable",Pro Co,Musical Instruments,Live Sound &amp; Stage,Stage &amp; Studio Cables,Instrument Cables,106182.0
B0002GFTJE,Remo KS0006-PH Double Falam Slam Patch (4-Inch),Remo,Musical Instruments,Instrument Accessories,Drum & Percussion Accessories,Drum Set Accessories,21719.0
B0002VR9HY,Rackmount Guitar Hanger,Wallacher,Musical Instruments,Guitars,,,591941.0
B0002GYV8E,"Zildjian K 14"" Hi Hat Cymbals Pair",Avedis Zildjian Company,Musical Instruments,Drums &amp; Percussion,Drum Sets &amp; Set Components,Cymbals,164176.0
B0009KKUBA,Perri's &quot;2&quot;&quot; Premium Cotton Guitar Strap Black 39 to 58 in.&quot;,Perri's,Musical Instruments,Instrument Accessories,Guitar & Bass Accessories,Straps & Strap Locks,497784.0
B00078RWAQ,Pignose PGG-200 Deluxe Electric Guitar  with Built-In Amp (Red),Pignose,Musical Instruments,Guitars,Electric Guitars,Solid Body,143332.0
B0002F6WSW,Gibraltar SC-JCM Jaw Cymbal Mount,Gibraltar,Musical Instruments,Instrument Accessories,Drum & Percussion Accessories,Hardware,36576.0
B0002H0RWC,Lee Oskar Harmonica Harmonic Minor D,Lee Oskar Harmonicas,Musical Instruments,Wind & Woodwind Instruments,Folk & World,Harmonicas,28029.0
B0002H0JZC,"D'Addario EJ27N Student Nylon Classical Guitar Strings, Normal Tension",D'Addario,Musical Instruments,Instrument Accessories,Guitar & Bass Accessories,Strings,1898.0
B0006BH7WW,"31"" Ennis Beginners Harp Package, Complete Celtic Package",HarpsOnly,Musical Instruments,Band &amp; Orchestra,Orchestral Strings,Harps,346442.0
B0006UGE9K,MXL 2006 Large Gold Diaphragm Condenser Microphone with MXL-57 Shock Mount and Carrying Case,MXL,Musical Instruments,Microphones &amp; Accessories,Microphones,Condenser Microphones,61517.0
B0002I1E8W,"Tipper, 2 knob with groove",Mid-East,Musical Instruments,Instrument Accessories,,,589421.0
B0002F592C,Vic Firth Corpsmaster Signature Snare -- Scott Johnson,Vic Firth,Musical Instruments,Instrument Accessories,Drum & Percussion Accessories,Drumsticks,243845.0
B0002GMX7U,Ovation T357 Tangent Super-Shallow Bowl Cutaway Acoustic-Electric Guitar (Black),,Musical Instruments,Drums & Percussion,Hand Percussion,Folk & World,580830.0
B0007XY8TO,HWP H-TGN Pad Saver for Tenor Saxophone Gooseneck,HW,Musical Instruments,Instrument Accessories,Wind & Woodwind Accessories,,15030.0
B0002I9RCC,Whirlwind MK450 Accusonic+2 Microphone Cable - 50 feet,Whirlwind,Musical Instruments,Live Sound &amp; Stage,Stage &amp; Studio Cables,Microphone Cables,32923.0
B0002F7IBC,Denis Wick DW5882-3C Silver-Plated Trumpet Mouthpiece,Denis Wick,Musical Instruments,Instrument Accessories,Brass Accessories,Mouthpieces,88922.0
B0009I2MRC,Hisonic HS707 Portable Battery Powered VHF La Valier and Headset Wireless Microphone System,Hisonic,Musical Instruments,Microphones & Accessories,Microphones,Wireless Microphones & Systems,92689.0
B0007D8R2I,SoundSoap 2,Bias,Musical Instruments,Studio Recording Equipment,Computer Recording,Software,16551.0
B0002F75FG,Schilke 112 Double Trumpet Case,Schilke,Musical Instruments,Instrument Accessories,Brass Accessories,Cleaning & Care,
B0007P4IRE,Elemental Designs eDead 80 Sound Deadening - 40Sq. Ft.,Elemental Designs,Musical Instruments,Studio Recording Equipment,Studio Environment,Acoustical Treatments,539414.0
B0002E39CU,HotSticks HS5AMACXLB 5A Hotsticks Black Xl Optic,HotSticks,Musical Instruments,Instrument Accessories,Drum & Percussion Accessories,Drumsticks,422768.0
B0009V8430,Harp Tuning Tool-Medium,Mid-East,Musical Instruments,Instrument Accessories,Orchestral Strings Accessories,,7295.0
B0007DGOQE,38&quot; Sunlike Guitar with Carrying Bag and Accessories,Crescent,Musical Instruments,Guitars,Acoustic Guitars,Steel-string Acoustics,366797.0
B0002F7IXA,DEG Trumpet Marching Lyre,DEG,Musical Instruments,Instrument Accessories,General Accessories,Music Lyres,22590.0
B0002IHEUE,Amigo AM30 Nylon String Acoustic Guitar,AMIGO,Musical Instruments,Guitars,Acoustic Guitars,Steel-string Acoustics,75201.0
B0002KZRGA,"Fender Jimmie Vaughan Tex Mex Stratocaster, Maple Fingerboard, Olympic White",Fender,Musical Instruments,Guitars,Electric Guitars,Solid Body,190289.0
B0007QKR28,"Planet Waves Custom Series Stereo Cable, 1/4 Inch to Dual Mono 1/4 Inch, 20 feet",D'Addario Accessories,Musical Instruments,Live Sound &amp; Stage,Stage &amp; Studio Cables,Instrument Cables,108775.0
B0009EXZS6,Monster Studiolink Balanced Interconnect 1 M. - XLR Connectors (M SL-X-1),Monster,Musical Instruments,Live Sound & Stage,Stage & Studio Cables,Instrument Cables,297403.0
B00094OT5E,My Ring Tone Studio - Convert Music Files to Ringtones,Tri Synergy,Musical Instruments,Studio Recording Equipment,Computer Recording,Software,60981.0
B0002GFRWI,Sonor Pair of Very Hard Wood Mallets (for Small Glockenspiels),Sonor,Musical Instruments,Instrument Accessories,Drum &amp; Percussion Accessories,Drumsticks,170208.0
B0002OOVS6,ART PS 4X4 Rack Power Strip,ART,Musical Instruments,Studio Recording Equipment,Power Conditioners,,27626.0
B0002F7FU6,Mollard Music Stand (MBT),Mollard,Musical Instruments,Instrument Accessories,General Accessories,Sheet Music Stands,42249.0
B0002F57EC,Seymour Duncan SCR-1N Cool Rails Neck Guitar Pickup - Black,Seymour Duncan,Musical Instruments,Instrument Accessories,Guitar &amp; Bass Accessories,Electric Guitar Parts,87182.0
B0002F75VA,"SwirlyGig SG1010 Drink Holder for 1/2 Tubing, Chrome",SwirlyGig,Musical Instruments,Microphones & Accessories,Accessories,,187999.0
B0006N8VP2,Ion iCD04FX Personal Audio Portable DJ Station,Ion,Musical Instruments,Live Sound &amp; Stage,PA Systems,,324675.0
B0002GL1XW,Latin Percussion LP444 Vibra-Slap Mounting Bracket,Latin Percussion,Musical Instruments,Instrument Accessories,Drum &amp; Percussion Accessories,Hardware,247275.0
B0002PCMEK,"Levy's Leathers MG12PDX-BRN 2.5-inch Leather Strap with Foam Core,Brown",Levy's Leathers,Musical Instruments,Instrument Accessories,Guitar & Bass Accessories,Straps & Strap Locks,277556.0
B0002GKRO6,Seymour Duncan STK-S2 Hot Single Coil Pickup Black Neck,Seymour Duncan,Musical Instruments,Instrument Accessories,Guitar & Bass Accessories,Electric Guitar Parts,45732.0
B0002KZIYG,"Fender 0054912000 Blues Junior Iii Cover, Black Vinyl",Fender,Musical Instruments,Instrument Accessories,Guitar & Bass Accessories,Amplifier Accessories,12672.0
B0002TKL9E,Woodwind Cork Grease,Woodwind,Musical Instruments,Instrument Accessories,Drum & Percussion Accessories,,64673.0
B0009EW1FO,Washburn Idol Series Electric Guitar,Washburn,Musical Instruments,Guitars,Electric Guitars,Solid Body,505796.0
B0002S096K,Audio Cleaning Lab 2005 [OLD VERSION],MAGIX,Musical Instruments,Studio Recording Equipment,Computer Recording,Software,23233.0
B0002TUX10,Leadsinger LS-3C06 Vegas and Elvis Cartridge for LS-3000 Series Karaoke System (100 Songs),Leadsinger,Musical Instruments,Electronic Music, DJ & Karaoke,Karaoke Equipment,191437.0
B0007UTVCG,Johnson Bottle Slide Triolian Resonator Guitar,Johnson,Musical Instruments,Guitars,Acoustic Guitars,Resonators,352361.0
B0002F58R8,Mollard Music Stand (P12ZW),Mollard,Musical Instruments,Instrument Accessories,General Accessories,Conducting Batons,53072.0
B0002F752Y,"Pearl DCL300P Drop Clutch, Felt Washers, Lock Nut",Pearl,Musical Instruments,Instrument Accessories,Drum & Percussion Accessories,,21347.0
B0002GWFEQ,Planet Waves Acoustic Guitar Quick-Release System,D'Addario Accessories,Musical Instruments,Instrument Accessories,Guitar & Bass Accessories,Straps & Strap Locks,3293.0
B0002F4X9M,Applause GBR91 Acoustic Guitar Gig Bag,,Musical Instruments,Instrument Accessories,Guitar & Bass Accessories,Bags & Cases,413291.0
B0007RJAXE,Refurbished - Yamaha DGX-500AD 88-Note Touch-Sensitive Portable Electronic Keyboard with AC Adapter,Yamaha,Musical Instruments,Keyboards & MIDI,Electronic Keyboards,Portable Keyboards,570403.0
B0002IL46Y,Selmer Covers for Walt Johnson Cases For Tenor Sax,SELMER,Musical Instruments,Instrument Accessories,Wind &amp; Woodwind Accessories,Bags &amp; Cases,418729.0
B0002F70RE,Trophy 8-Note Children's Xylophone,Trophy,Musical Instruments,Drums & Percussion,Concert Percussion,Xylophones,294956.0
B0002F7AEC,Pintech Percussion XT-14 14&quot; Crash/Hi-Hat Practice Cymbal,Pintech Percussion,Musical Instruments,Drums & Percussion,Electronic Drums,,22781.0
B0002FOI2E,Latin Percussion LPA630A 12-1/2-Inch Aspire Djembe Head,Latin Percussion,Musical Instruments,Drums &amp; Percussion,Folk &amp; World Hand Drums,Djembes,41362.0
B0002WSKFS,Lauren LAPKMRD 30-Inch Student Guitar Package - Metallic Red,Lauren,Musical Instruments,Guitars,Acoustic Guitars,Beginner Kits,84188.0
B0002F73Z8,Vic Firth American Classic 5B Drumsticks,Vic Firth,Musical Instruments,Instrument Accessories,Drum &amp; Percussion Accessories,Drumsticks,22522.0
B0002F7JG6,K &amp; M 15270B Trombone Stand,K & M,Musical Instruments,Instrument Accessories,General Accessories,Sheet Music Stands,97965.0
B0002F5I6Y,ML1 Artist Series Pro Bb Trumpet ML1S - Silver,Unknown,Musical Instruments,Band &amp; Orchestra,Brass,Trumpets,588980.0
B0006ZROF8,ACOUSTIC PICKGUARD BLACK LH,WD Music Products,Musical Instruments,Instrument Accessories,Guitar &amp; Bass Accessories,Acoustic &amp; Classical Guitar Parts,290582.0
B0002GYH2E,"ESP LTD KH-202 Kirk Hammett Electric Guitar, Black",ESP Guitars,Musical Instruments,Guitars,Electric Guitars,Solid Body,35241.0
B0006VXA9Q,Seiko Digital Metronome DM-20,Seiko,Musical Instruments,Instrument Accessories,General Accessories,Metronomes,
B0008IUVO4,"Barcelona Beginner Series Double Cutaway Electric Guitar Bundle with 10-Watt Amp, Gig Bag, Instrument Cable, Tremolo Bar, Strap, Strings, Picks, and Polishing Cloth - Sunburst",Barcelona,Musical Instruments,Guitars,Electric Guitars,Beginner Kits,213268.0
B0002GX96Y,GHS Bass Guitar Boomers 5-String High C 30-100 5M-C-DYB,Ghs,Musical Instruments,Instrument Accessories,Guitar & Bass Accessories,Strings,80722.0
B0002F5CEC,Vic Firth Heavy Hitter Quadropad Large,Vic Firth,Musical Instruments,Instrument Accessories,Drum & Percussion Accessories,Practice Pads & Devices,23757.0
B0002ZPJYA,"Sanyo ST09D, ST-09D Stylus",Sanyo,Musical Instruments,Electronic Music, DJ &amp; Karaoke,DJ Equipment,21621.0
B0002F6MSM,Rogue Honduran Mahogany Dreadnought Natural,Rogue,Musical Instruments,Guitars,Acoustic Guitars,Steel-string Acoustics,289592.0
B0007LTYUE,Latin Percussion LP592A Claw for Mic,Latin Percussion,Musical Instruments,Microphones &amp; Accessories,Accessories,Clips,101667.0
B0009A6S8E,Promark TB6 Telescoping Wire Brushes,Promark,Musical Instruments,Instrument Accessories,Drum & Percussion Accessories,Drumsticks,82944.0
B0002GH9BK,MIDI Solutions Continuous MIDI Data Pedal Controller,MIDI Solutions,Musical Instruments,Studio Recording Equipment,Computer Recording,MIDI Controllers,127175.0
B0002F5F8A,"True Colors Tambourine, Yellow, 10&quot; (TC4050)",True Colors,Musical Instruments,Drums & Percussion,Hand Percussion,Tambourines,45690.0
B0007SMB8Y,"Seymour Duncan SH-8b Invader Humbucker Bridge Pickup, Zebra",Seymour Duncan,Musical Instruments,Instrument Accessories,Guitar & Bass Accessories,Electric Guitar Parts,91603.0
B0002F6WIC,Pork Pie Big Boy Bicycle Throne Red with Leopard Top,Pork Pie,Musical Instruments,Instrument Accessories,Drum & Percussion Accessories,Drum Set Accessories,233866.0
B0002GIRJI,Radial J48 MK2 48V Phantom Power Active Direct Box,Radial Engineering,Musical Instruments,Studio Recording Equipment,Signal Processors,Direct Boxes,10871.0
B00061P82S,Glaesel Self-Adjusting Bass Bridge with Wheels 3/4 Size,Glaesel,Musical Instruments,Instrument Accessories,Guitar & Bass Accessories,Bass Guitar Parts,260125.0
B0002H0HK4,TASCAM 2488 Mark II 24-Track Digital Recording Workstation,Tascam,Musical Instruments,Studio Recording Equipment,Multitrack Recorders,Digital,334276.0
B0002ZO3JW,On-Stage DM50 Drum Rim Microphone Clamp,OnStage,Musical Instruments,Microphones & Accessories,Accessories,Clips,25301.0
B0002M728O,JJ Electronics 12AU7 / ECC82 Preamp Vacuum Tube,JJ Electronic,Musical Instruments,Instrument Accessories,Guitar & Bass Accessories,Amplifier Accessories,6877.0
B0007PKM0G,"Dunlop JCS50C Johnny Cash Capo, Curved",JIM DUNLOP,Musical Instruments,Instrument Accessories,Guitar & Bass Accessories,Capos,24971.0
B0002H0FL0,RockBass by Warwick Corvette Classic 5-String Electric Bass (Almond Burst),,Musical Instruments,Bass Guitars,Electric Basses,,596612.0
B0002IHEEK,"REMO Djembe, MONDO, Key-Tuned, 16"" x 27"", SKYNDEEP FIBERSKYN, Contour Tuning Brackets, Kintekloth Finish",Remo,Musical Instruments,Drums &amp; Percussion,Folk &amp; World Hand Drums,Djembes,229844.0
B00099QVXC,"Dean Custom Zone Solid Body Electric Guitar, 2 Humbuckers Florescent Pink",Dean Guitars,Musical Instruments,Guitars,Electric Guitars,Solid Body,179439.0
B0002HU8QW,Vic Firth Signature Series -- Jack DeJohnette,Vic Firth,Musical Instruments,Instrument Accessories,Drum &amp; Percussion Accessories,Drumsticks,13569.0
B0002F4Y8C,Hodge BB1 Bassoon Black Silk Swab,Hodge,Musical Instruments,Instrument Accessories,Wind &amp; Woodwind Accessories,Parts,27538.0
B0002M71VC,Sovtek 12AX7LPS Vacuum Tube,Sovtek,Musical Instruments,Instrument Accessories,Guitar & Bass Accessories,Amplifier Accessories,18453.0
B0006ZPAHC,ULTRA DELUXE CLASSIC TUNERS GOLD,WD Music,Musical Instruments,Instrument Accessories,Guitar & Bass Accessories,Electric Guitar Parts,578236.0
B0002F4VNA,Latin Percussion LP451 Multi Guiro Ii,Latin Percussion,Musical Instruments,Drums & Percussion,Hand Percussion,Folk & World,104709.0
B0002GZSKY,"Epiphone DOT ES Style Semi-Hollowbody Electric Guitar, Vintage Sunburst",Epiphone,Musical Instruments,Guitars,Electric Guitars,Solid Body,154938.0
B0002HCZ4K,Shure  WL184 Lavalier Condenser Microphone,Shure,Musical Instruments,Microphones & Accessories,Microphones,,35495.0
B0002F75K6,"Squier 'Mini' - Torino Red with Picks, Tuner, Strap, and Amp",Squier,Musical Instruments,Guitars,Electric Guitars,,141205.0
B00030CTCE,Pico 1865PT 16-14 AWG(Blue) Nylon Fully Insulated Electrical Wiring 0.250&quot; Tab Female Quick Connect Receptacle Terminal 50 Per Package,Pico,Musical Instruments,Drums & Percussion,,,2601647.0
B0002TJXTS,Sennheiser MZW66 Grey Foam Windscreen for the ME66 Microphone,Sennheiser,Musical Instruments,Microphones & Accessories,Accessories,Windscreens & Pop Filters,27766.0
B0002GFP66,"Rico Grand Concert Select Alto Sax Reeds, Strength 3.0, 10-pack",D'Addario Woodwinds,Musical Instruments,Instrument Accessories,Wind & Woodwind Accessories,Reeds,13239.0
B0002GVCX6,Basic Beat 8&quot; Single Hand Bongo,Basic Beat,Musical Instruments,Drums & Percussion,Folk & World Hand Drums,Bongos,19898.0
B0002F6MRS,Rogue Herringbone 12-String Acoustic Guitar Natural,Rogue,Musical Instruments,Guitars,Acoustic Guitars,Steel-string Acoustics,305928.0
B0006YY5V0,"D'Addario BEC028 Folk Nylon Guitar Single String, Clear Nylon, Ball End, .028",D'Addario,Musical Instruments,Instrument Accessories,Guitar &amp; Bass Accessories,Strings,28156.0
B0002NRTMC,American DJ Haze/G Haze Juice for Haze Generator (Gallon),American DJ,Musical Instruments,Live Sound &amp; Stage,Special Effects,Bubble Machines,71690.0
B0002GZ35Y,Lighting PAR 64A Can,WAC Lighting,Musical Instruments,Live Sound & Stage,Lighting Equipment & Accessories,Stage Lights,63532.0
B0006GRRQ8,Gator G-SLNG-DLX-2XEL Deluxe Slinger Double Electric Guitar Bag,Gator,Musical Instruments,Instrument Accessories,Guitar &amp; Bass Accessories,Bags &amp; Cases,540551.0
B0009RQV02,Vic Firth Orchestral Series Keyboard -- Medium Poly,Vic Firth,Musical Instruments,Instrument Accessories,Drum & Percussion Accessories,Drumsticks,26161.0
B0002FOI88,Jones JR201MS Bassoon Reed; Medium Soft,Jones,Musical Instruments,Instrument Accessories,Wind &amp; Woodwind Accessories,Reeds,1454.0
B0002EWTYE,Selmer BE402-31 Brilhart Ebolin Alto Saxophone Mouthpiece - Model 3*,SELMER,Musical Instruments,Instrument Accessories,Wind & Woodwind Accessories,Mouthpieces,34404.0
B0002F597C,"Bari Reed for Bass Clarinet, Soft",Barireed,Musical Instruments,Instrument Accessories,Wind & Woodwind Accessories,Reeds,218537.0
B0002H05C4,Gibraltar SC-268R Bass Drum Hoop Bell Mount 9.5Mm Rod,Gibraltar,Musical Instruments,Drums & Percussion,Drum Sets & Set Components,Cymbals,8414.0
B00076GUHO,Shure UA600,Shure,Musical Instruments,Microphones & Accessories,Accessories,,90591.0
B0002LDEOG,Ultimate Support TS-70B Aluminum Tripod Speaker Stand with Safe and Secure Locking Pin and 150 lb Load Capacity - Black,Ultimate Support,Musical Instruments,Live Sound & Stage,Monitors, Speakers & Subwoofers,97480.0
B0009E3EW8,Off The Wall Guitar Hanger - (for Wider Neck Instruments),Off The Wall,Musical Instruments,Instrument Accessories,Guitar & Bass Accessories,Tools,66244.0
B0002F75LA,Fender 0321602509Squier by Standard Telecaster Beginner Electric Guitar - Antique Burst,Fender,Musical Instruments,Guitars,Electric Guitars,Solid Body,29274.0
B0002G10QU,"Auralex Acoustics LENCHA LENRD Acoustic Absorption Bass Traps, 24"" x 12"" x 12"", 8 Pack, Charcoal",Auralex Acoustics,Musical Instruments,Studio Recording Equipment,Studio Environment,Acoustical Treatments,25227.0
B0002GTZQM,Dunlop D3810GY Cammo Gray Strap,JIM DUNLOP,Musical Instruments,Instrument Accessories,Guitar & Bass Accessories,Straps & Strap Locks,123004.0
B0002FOD74,Trophy 8490 Soprano Recorder Swab - Colors may vary,Trophy,Musical Instruments,Instrument Accessories,Wind & Woodwind Accessories,Cleaning & Care,4308.0
B0002GOK08,Dava 0109 Master Control Nickel Silver,Dava,Musical Instruments,Instrument Accessories,,,31771.0
B00099XXZQ,Hameln B-flat Trumpet with Monel Valves &amp; Polished Nickel Finish,HAMELN,Musical Instruments,Band & Orchestra,Brass,Trumpets,570817.0
B0002OMOIU,DR Strings Rare - Phosphor Bronze AcousticHex Core 11-50,DR Strings,Musical Instruments,Instrument Accessories,Guitar & Bass Accessories,Strings,27559.0
B0009VCQ2U,"Tabla Cushion &amp; Cover for Bayan, Deluxe",Mid-East,Musical Instruments,Drums & Percussion,Folk & World Hand Drums,Tablas,57445.0
B0002F56SE,Vater Percussion Timbale 7/16 Hickory,Vater,Musical Instruments,Instrument Accessories,Drum &amp; Percussion Accessories,Drumsticks,62820.0
B0002H06LO,Gibraltar SC-TC Triangle Clip Mount,Gibraltar,Musical Instruments,Instrument Accessories,Drum & Percussion Accessories,Hardware,61811.0
B0006TW04E,Dynex Portable Wireless Fm Transmitter,Dynex,Musical Instruments,Microphones &amp; Accessories,Microphones,Wireless Microphones &amp; Systems,402594.0
B0002GNYA0,Rotosound RS77LE Monel Flatwound Bass Guitar Strings (50 75 95 110),ROTOSOUND,Musical Instruments,Instrument Accessories,Guitar & Bass Accessories,Strings,27390.0
B0002GXF8Q,"On-Stage Foam Ball-Type Microphone Windscreen, Black",OnStage,Musical Instruments,Microphones & Accessories,Accessories,Windscreens & Pop Filters,45.0
B0002GH97E,MIDI Solutions 2-Output Active MIDI Thru Box,MIDI Solutions,Musical Instruments,Studio Recording Equipment,Computer Recording,MIDI Interfaces,14986.0
B0002F5I5K,"Yamaha YRN-22B Barouque 2-Piece Sopranino Recorder, Key of F",Yamaha,Musical Instruments,Band &amp; Orchestra,Wind &amp; Woodwinds,Recorders,284627.0
B0002GMGQI,"Planet Waves Bulk Instrument Cable, 250 feet",D'Addario Accessories,Musical Instruments,Live Sound & Stage,Stage & Studio Cables,Instrument Cables,223075.0
B0002F5C42,Meinl NINO Wood Animal-Turtle,Nino Percussion,Musical Instruments,Drums & Percussion,Hand Percussion,Sound Effects,195219.0
B0002F74PW,"Pearl TH2000S Tom Holder, Gyro-Lock System, Short",Pearl,Musical Instruments,Instrument Accessories,Drum & Percussion Accessories,Hardware,350507.0
B0002L52PA,"Ovation Applause UA10-4 Standard Ukulele, Natural",Applause,Musical Instruments,Ukuleles, Mandolins &amp; Banjos,Ukuleles,288593.0
B0007UPZW6,DVFORGE JamPlug Guitar Amp,DVForge,Musical Instruments,Amplifiers & Effects,Guitar & Bass Amplifiers,Electric Guitar Amplifiers,1489405.0
B0006ZUZWC,"Planet Waves Suede Guitar Strap, Black",D'Addario Accessories,Musical Instruments,Instrument Accessories,Guitar & Bass Accessories,Straps & Strap Locks,68892.0
B0002KZVVQ,"Fender Mustang Electric Bass Guitar, Rosewood Fretboard, 4-Ply Tortoise Shell Pickguard - Vintage White",Fender,Musical Instruments,Bass Guitars,Electric Basses,,305052.0
B0002HLKQO,Kaces Symphony Series 3/4 Size Cello Bag (KCB3/4),Kaces,Musical Instruments,Instrument Accessories,Orchestral Strings Accessories,Bags &amp; Cases,154699.0
B0002SZETW,"D'Addario Pro-Arte Viola String Set, Long Scale, Medium Tension",D'Addario,Musical Instruments,Instrument Accessories,Orchestral Strings Accessories,Strings,75600.0
B0002GVG3M,14&quot; Di Hu Yin Opera Gong,Unknown,Musical Instruments,Drums & Percussion,Drum Sets & Set Components,Gongs,565298.0
B0002EKNQ0,Seymour Duncan SH-4 JB Model Humbucker Pickup - Nickel,Seymour Duncan,Musical Instruments,Instrument Accessories,Guitar & Bass Accessories,Electric Guitar Parts,12665.0
B0002IL3G0,Rhythm Band Musical Steel Triangle 5 in.,Rhythm Band,Musical Instruments,Drums &amp; Percussion,Hand Percussion,Triangles,60003.0
B0009TD5X6,MXL-603S INSTRUMENT MIC  (Wired With Mogami),MXL,Musical Instruments,Microphones & Accessories,Microphones,Condenser Microphones,103348.0
B0006NMUEU,Shure Shure A57F Microphone Clip,Shure,Musical Instruments,Microphones &amp; Accessories,Accessories,Clips,26629.0
B0002F53YQ,Mike Balter MB12R Mallets Rattan Grn Med Hard,Mike Balter,Musical Instruments,Instrument Accessories,Drum &amp; Percussion Accessories,Drumsticks,232244.0
B0002FO2IO,Crosley NP1 Replacement Needle,Crosley,Musical Instruments,Electronic Music, DJ & Karaoke,DJ Equipment,4.0
B0002OOMW6,"Jim Dunlop 6554 Dunlop Ultimate Lemon Oil, 4 oz.",JIM DUNLOP,Musical Instruments,Instrument Accessories,Guitar &amp; Bass Accessories,,2028.0
B0002Y2UES,"Rhythm Band RB750 Musical Triangle, Steel, 6&quot; Size",Rhythm Band,Musical Instruments,Drums & Percussion,Hand Percussion,Triangles,114321.0
B0002GZQG0,"Martin M450 Bluegrass 80/20 Mandolin Strings, Light-Medium",Martin,Musical Instruments,Instrument Accessories,Folk & World Instrument Accessories,Mandolin Accessories,74916.0
B0002F59F4,DAddario Woodwinds Accordion Accessory (RJA2520),D'Addario Woodwinds,Musical Instruments,Instrument Accessories,Wind &amp; Woodwind Accessories,Reeds,45870.0
B0007Y1ZM6,Humes &amp; Berg Stonelined Cup French Horn Mute (123),Humes & Berg,Musical Instruments,Instrument Accessories,Brass Accessories,Mutes,214571.0
B0002GY9Y0,MXR M103 Blue Box Octave Fuzz,MXR,Musical Instruments,Amplifiers & Effects,Guitar Effects,Electric Guitar Effects,36392.0
B0002GJTO0,"JBL Professional 500-watt Dual 15-Inch Two-Way Portable Loudspeaker, Black (JRX125)",JBL Professional,Musical Instruments,Live Sound & Stage,Monitors, Speakers & Subwoofers,175166.0
B0009N7V6Y,DiMarzio DP209 Super Distortion P-90 Humbucker Pickup Black,DiMarzio,Musical Instruments,Instrument Accessories,Guitar & Bass Accessories,Electric Guitar Parts,84330.0
B0002GFQY2,Remo BD0315-00 Clear Diplomat Drum Head - 15-Inch,Remo,Musical Instruments,Instrument Accessories,Drum &amp; Percussion Accessories,Drum Set Accessories,153056.0
B00065QSXW,Road Ready RRCFX12 Case for Mackie CFX12MKII Mixer,Road Ready,Musical Instruments,Electronic Music, DJ & Karaoke,DJ Equipment,128517.0
B0009JMW9E,Kun Collapsible Music Stand (K400C),Kun,Musical Instruments,Instrument Accessories,Orchestral Strings Accessories,Shoulder & Chin Rests,9717.0
B0002KZTN6,"Fender FM-52E Mandolin, Sunburst",Fender,Musical Instruments,Ukuleles, Mandolins &amp; Banjos,Mandolins,186806.0
B0007M8OX6,Proco EG Excellines Series Instrument Cables,Proco,Musical Instruments,Live Sound & Stage,Stage & Studio Cables,Instrument Cables,60318.0
B0007OGTGS,"Chief Raxxess UNS1 Vented Universal Rack Tray Shelf for 19"" Server Racks, with Bottom Slots for Mounting Non-Rack and Half-Rack Equipment",Raxxess,Musical Instruments,Studio Recording Equipment,Studio Environment,Rack Accessories,243.0
B0002WSKCQ,Lauren LA36 36-Inch Student Guitar,Lauren,Musical Instruments,Guitars,Acoustic Guitars,Steel-string Acoustics,113066.0
B0002VCUJ6,Don't Fret Finger Position Markers for Cello 3/4,Don't Fret,Musical Instruments,Instrument Accessories,,,99147.0
B0002EOJ38,3C Trumpet Mouthpiece,,Musical Instruments,Instrument Accessories,Brass Accessories,Mouthpieces,383251.0
B0007ZCHKY,Ludwig L215FP Combo Single Bass Drum Pedal,Ludwig,Musical Instruments,Drums & Percussion,Drum Sets & Set Components,Drums,441340.0
B0002F4N7Y,"LP150 Cyclops, Steel Jingles, Black, Hand Held Tambourine",Latin Percussion,Musical Instruments,Drums & Percussion,Hand Percussion,Tambourines,21870.0
B0002H0H3Q,Blue Microphones Series 2 Shockmount,Blue,Musical Instruments,Microphones & Accessories,Accessories,Mounts,88813.0
B0002F5FF8,"ESP LTD Standard F104 Electric Bass Guitar, Black",ESP Guitars,Musical Instruments,Guitars,Electric Guitars,Solid Body,154926.0
B0002MS9OK,Banjo Mandolin w/ case,Lark in the Morning,Musical Instruments,Ukuleles, Mandolins &amp; Banjos,Banjos,598195.0
B0002GY10M,"Atlas AD11BE 5/8-Inch 27 Thread Surface Mount Female Microphone Flange, Ebony Finish",Atlas,Musical Instruments,Microphones &amp; Accessories,Accessories,,18761.0
B0002L51JM,"Sabian Cymbal Variety Package, inch (21406XB)",Sabian,Musical Instruments,Drums & Percussion,Drum Sets & Set Components,Cymbals,97157.0
