asin,title,brand,main_category,second_category,third_category,fourth_category,rank
B0009KJ214,JoRal TRB1 PTenor Trombone Practice Mute,JoRal,Musical Instruments,Instrument Accessories,Brass Accessories,Mutes,246086.0
B0002Z82L2,Behringer PMH2000 10-Channel Power Mixer with 24-Bit Multi-FX Processor,Behringer,Musical Instruments,Live Sound &amp; Stage,Powered Mixers,,585304.0
B0002ZO5XG,Blue Sky MediaDesk 2.1 Active Studio Monitor System,Blue Sky,Musical Instruments,Studio Recording Equipment,Studio Monitors,,512024.0
B0002F6IE0,Washburn D10S Dreadnought Acoustic Guitar (Natural),Washburn,Musical Instruments,Guitars,Acoustic Guitars,Steel-string Acoustics,405551.0
B0002GYYRW,DigiTech RP80 Multi Effect Pedal,DigiTech,Musical Instruments,Amplifiers & Effects,Guitar Effects,Electric Guitar Effects,195444.0
B0002GWEHE,Alesis PlayMate Vocalist,Alesis,Musical Instruments,Studio Recording Equipment,Signal Processors,Effects Processors,396496.0
B0002F6ZVQ,Suzuki Harmonica (1072-A),Suzuki,Musical Instruments,Wind & Woodwind Instruments,Folk & World,Harmonicas,133766.0
B0002OERQC,Hear Technologies Hearbuds and Headset,Hear Technologies,Musical Instruments,Studio Recording Equipment,Headphone & In-Ear Audio Monitors,Earphones,504943.0
B0002FONVA,Latin Percussion Matador Strap-Lock Bongo Stand,Latin Percussion,Musical Instruments,Instrument Accessories,,,49078.0
B0002GO16Q,DiMarzio Instrument Cable Vintage Tweed 10 ft.,DiMarzio,Musical Instruments,Live Sound & Stage,Stage & Studio Cables,Instrument Cables,213714.0
B000981H28,Humes and Berg Stonelined Short Plunger Straight Trombone Mute (156),Humes & Berg,Musical Instruments,Instrument Accessories,Brass Accessories,Mutes,163987.0
B0002GJ2WO,"Planet Waves Ebony Bridge Pins with End Pin Set, Brass Head",D'Addario Accessories,Musical Instruments,Instrument Accessories,Guitar & Bass Accessories,Acoustic & Classical Guitar Parts,423822.0
B0002F5936,Vic Firth Corpsmaster Signature Snare -- Thom Hannum Piccolo Tip,Vic Firth,Musical Instruments,Instrument Accessories,Drum & Percussion Accessories,Drumsticks,14743.0
B0009FCD06,DR Strings Tite Fit Electric Round Core 9-46,DR Strings,Musical Instruments,Instrument Accessories,Guitar & Bass Accessories,Strings,50967.0
B0002LD2U2,Basic Beat Pair of Hand Decorated Wood Maracas,Basic Beat,Musical Instruments,Drums &amp; Percussion,Hand Percussion,Folk &amp; World,340184.0
B0002F4W0M,Promark B300 Accent Wood-Handle Wire Brushes,Promark,Musical Instruments,Instrument Accessories,Drum &amp; Percussion Accessories,Drumsticks,52087.0
B0002F4MKC,WUHAN WU104-12 China Cymbal,WUHAN,Musical Instruments,Drums & Percussion,Drum Sets & Set Components,Cymbals,6013.0
B0002GVHZE,Basic Beat Kokiriko,Basic Beat,Musical Instruments,Drums &amp; Percussion,Hand Percussion,Folk &amp; World,145103.0
B0002F5BXE,Nino Percussion NINO513GR Wood Frog Giro,Nino Percussion,Musical Instruments,Instrument Accessories,Drum &amp; Percussion Accessories,,92785.0
B0002GJNNC,"Gibson Brite Wires Electric Guitar Strings, Medium 11-50",Gibson Gear,Musical Instruments,Guitars,,,7627.0
B0002F7J0M,DEG Magnum Mouthpiece Puller,DEG,Musical Instruments,Instrument Accessories,Brass Accessories,Mouthpieces,246872.0
B0002TKK4A,Woodwind Bore Oil,Woodwind,Musical Instruments,Instrument Accessories,Wind & Woodwind Accessories,Cleaning & Care,79113.0
B0002XL90U,Carlo Robelli W4103FCS Acoustic Electric Guitar (Flame Coffee Burst),Carlo Robelli,Musical Instruments,Guitars,Acoustic-Electric Guitars,,314971.0
B0002F5AFS,"Meinl Cymbals GX-TB14/16/18 Generation-X Thomas Lang Becken Cymbal Set: 14 Inch China, 16 Inch Crash, 18 Inch Crash/Ride (VIDEO)",Meinl Cymbals,Musical Instruments,Drums & Percussion,Drum Sets & Set Components,Cymbals,400156.0
B0002OS9G6,Hartke VX3500 Bass Combo,Hartke,Musical Instruments,Amplifiers & Effects,Guitar & Bass Amplifiers,Bass Guitar Amplifiers,214785.0
B0002PYXA6,Promark B600 Nylo-Brush Nylon-Bristle Retractable Brushes-(1 pair),Promark,Musical Instruments,Instrument Accessories,Drum & Percussion Accessories,Drumsticks,11548.0
B0002GWRIK,Dunlop DD4009BK Double D Solid Black Extra Long Strap,JIM DUNLOP,Musical Instruments,Instrument Accessories,Guitar & Bass Accessories,Straps & Strap Locks,3015.0
B0002F4TN2,"Hohner CX-12 Black, Key of C",Hohner Accordions,Musical Instruments,Wind &amp; Woodwind Instruments,Folk &amp; World,Harmonicas,49651.0
B0009AJ2SC,DW DWSM803-2 Hi-Torq Steel Drum key and Standard Key with Clip Holder,DW,Musical Instruments,Instrument Accessories,Drum & Percussion Accessories,Drum Set Accessories,56770.0
B0002F71CI,Leblanc Vito II Bb Clarinet Mouthpiece,LE BLANC,Musical Instruments,Instrument Accessories,Wind & Woodwind Accessories,Mouthpieces,72467.0
B0009R2XJ0,Hameln Red &amp; Gold Flute with Plateau Keys,HAMELN,Musical Instruments,Band & Orchestra,Wind & Woodwinds,Flutes,572298.0
B0006ZUZOA,Regal Tip BR-594P Ed Thigpen Plastic Brushes Black Poly-Rod Brush in Clear Heavy-Duty Handle-Single Pair,Regal Tip,Musical Instruments,Instrument Accessories,Drum & Percussion Accessories,Drumsticks,57795.0
B0002H0STE,Sabian Paragon Neil Peart Complete Cymbal Set with Flight Case,Sabian,Musical Instruments,Drums & Percussion,Drum Sets & Set Components,Cymbals,315364.0
B0002GOK2G,SKB SKB-61 Deluxe Double Cutaway Electric Guitar Case,SKB,Musical Instruments,Instrument Accessories,Guitar & Bass Accessories,Bags & Cases,18881.0
B0006FUFPY,Hear Technologies Hear Back Hub,Hear Technologies,Musical Instruments,Amplifiers &amp; Effects,Guitar &amp; Bass Amplifiers,Electric Guitar Amplifiers,273016.0
B0009V8YXA,Latin Percussion LP637 Rubber Conga Feet,Latin Percussion,Musical Instruments,Drums & Percussion,Folk & World Hand Drums,Congas,11187.0
B0002J1AAI,Moog CP-251 Moogerfooger Control Processor,Moog Music Inc.,Musical Instruments,Keyboards &amp; MIDI,Electronic Keyboards,Synthesizers &amp; Workstations,79376.0
B00074B67A,"Levy's Leathers MM4 Wireless Receiver Holder for Guitar, Black",Levy's Leathers,Musical Instruments,Instrument Accessories,Guitar &amp; Bass Accessories,,5411.0
B0006N4160,Penn-Elcom R1285/1UK Blank Rack Panel 1U,Penn Elcom,Musical Instruments,Studio Recording Equipment,Studio Environment,Rack Accessories,162786.0
B0002H00O2,Gibraltar SC-BDHG Bass Drum Hoop Guard 2/Pack,Gibraltar,Musical Instruments,Instrument Accessories,Drum & Percussion Accessories,,11728.0
B0002F71CS,Gibraltar SC-TL1A Floor Tom Legs 9.5Mm 3/Pack,Gibraltar,Musical Instruments,Instrument Accessories,Drum &amp; Percussion Accessories,,6797.0
B0002NRYOA,RhythmTech MC2 Wireless Mic Clip,Rhythm Tech,Musical Instruments,Microphones &amp; Accessories,Microphones,Wireless Microphones &amp; Systems,117734.0
B0002F7IK8,Rogue Grand Concert Cutaway Acoustic-Electric Guitar Natural,Rogue,Musical Instruments,Guitars,Acoustic-Electric Guitars,,382198.0
B0006FTKYG,"iPod Photo Dock USB 2.0, FireWire, Digital Audio Line Out",Apple,Musical Instruments,Studio Recording Equipment,Computer Recording,Audio Interfaces,1676.0
B0002II6KG,Glaesel 4/4 Violin Ribbed Plastic Chin Rest,Glaesel,Musical Instruments,Instrument Accessories,Orchestral Strings Accessories,Shoulder &amp; Chin Rests,47140.0
B0002M6TGU,Gard Cordura Tuba Gig Bag 63-SK - Fits up to 19.5 Bell and 39 Height,Gard,Musical Instruments,Instrument Accessories,Brass Accessories,Bags & Cases,290406.0
B0002X07F8,Groove Percussion JB10 Drum Throne,Groove Percussion,Musical Instruments,Instrument Accessories,Drum & Percussion Accessories,Drum Set Accessories,550380.0
B0002EQVXY,NADY UHF-3LT470.55 Uhf Diversity Receiver with UH-3 Lavalier Bodypack Transmitter,Nady,Musical Instruments,Microphones & Accessories,Microphones,Wireless Microphones & Systems,394278.0
B0002PZBLG,Echo Mia 24Bit 96K PCI Audio Interface,Echo,Musical Instruments,Studio Recording Equipment,Computer Recording,Audio Interfaces,279526.0
B0002MS9Q8,8 String Banjo Mandolin,Lark in the Morning,Musical Instruments,Ukuleles, Mandolins &amp; Banjos,Banjos,595700.0
B0002VCUG4,Don't Fret Finger Position Markers for Violin and Viola 1/2 Vln Or 12 in. Viola,Don't Fret,Musical Instruments,Instrument Accessories,Orchestral Strings Accessories,,190526.0
B0007PAQ20,"Yamaha WB2 Padded Wooden Bench for the Yamaha DGX505 and DGX620, Natural Finish",Yamaha,Musical Instruments,Instrument Accessories,Keyboard Accessories,Benches,33680.0
B0002H7U6I,44&quot; Continental Console Piano (Ebony Polish),Rawlings,Musical Instruments,Keyboards & MIDI,,,601446.0
B0002MJCIM,"JBL JRX118SP Self-Powered Single 18-inch 350 Watt Subwoofer, Dual Inputs, Built in crossover",JBL Professional,Musical Instruments,Live Sound & Stage,Monitors, Speakers & Subwoofers,180547.0
B0002GUAZM,"Gator 10U Top, 2U Side Console Audio Rack (GRC-10X2)",Gator,Musical Instruments,Studio Recording Equipment,Studio Environment,Racks,218327.0
B0006MZLZ6,Penn-Elcom C1823K Metal Cabinet Corner Black 3 Leg,Penn Elcom,Musical Instruments,Studio Recording Equipment,,,132041.0
B0007U10YS,Chauvet DJ  CH-BOB Bob(TM) Flame Light (Effect),Chauvet,Musical Instruments,Live Sound &amp; Stage,Special Effects,Flame Effects,357596.0
B0002TKJWI,Woodwind Oboe Reeds Medium Soft (Medium Soft),Woodwind,Musical Instruments,Instrument Accessories,Wind & Woodwind Accessories,Reeds,183813.0
B0002F7EP2,Gibraltar SC-GPR435 43.5 Inch Straight Rack Tube,Gibraltar,Musical Instruments,Instrument Accessories,Drum & Percussion Accessories,Hardware,67376.0
B0002GJU26,"Gibson Gear SEG-900M Coated Steel Electric Guitar Strings, Jazz Medium",Gibson Gear,Musical Instruments,Instrument Accessories,Guitar &amp; Bass Accessories,Strings,424530.0
B0002GFQ10,Hamilton Stands Acoustic Guitar Case (KB70),Hamilton Stands,Musical Instruments,Instrument Accessories,General Accessories,Sheet Music Stands,3670.0
B0002KZTM2,Fender FV-3 Deluxe Acoustic-Electric Violin - Sunburst Ebony,Fender,Musical Instruments,Band & Orchestra,Orchestral Strings,Violins,309341.0
B0002H0NO4,Dean Markley 2062A Markley Strngs Phos Brnz Xl,Dean Markley,Musical Instruments,Instrument Accessories,Guitar & Bass Accessories,Strings,474749.0
B0002F558A,Yamaha YAC-1617 Eb Baritone Sax Ligature Gold 5C,Yamaha,Musical Instruments,Instrument Accessories,Wind & Woodwind Accessories,Ligatures,44582.0
B0002E59V4,Hohner Marine Band Hi-G,Hohner Accordions,Musical Instruments,Instrument Accessories,General Accessories,,327231.0
B0007QKR1Y,"Planet Waves Custom Series Stereo Cable, 1/4 Inch to Dual Mono 1/4 Inch, 10 feet",D'Addario Accessories,Musical Instruments,Live Sound &amp; Stage,Stage &amp; Studio Cables,Instrument Cables,147444.0
B0009V9X2G,"Nylon Case for 22"" Frame Drum",Mid-East,Musical Instruments,Instrument Accessories,Drum &amp; Percussion Accessories,Bags,216798.0
B0002TUWX4,Leadsinger LS-3C09 Classic Country Cartridge for LS-3000 Series Karaoke System (200 Songs),Leadsinger,Musical Instruments,Electronic Music, DJ &amp; Karaoke,Karaoke Equipment,60649.0
B0002F4Y00,Hodge Silk Bassoon Bocal Swab - Black,Hodge,Musical Instruments,Instrument Accessories,Wind & Woodwind Accessories,Parts,13445.0
B0002H06ZA,"Epiphone Les Paul STUDIO Electric Guitar,  Ebony",Epiphone,Musical Instruments,Guitars,Electric Guitars,Solid Body,135607.0
B0008D5FN6,"Nady ACCESS PSS-150 Transportable 150 Watt Five Channel Mixer with Effects, Mic and Cable",Nady,Musical Instruments,Electronic Music, DJ &amp; Karaoke,DJ Equipment,366620.0
B0002FOY1Y,Bellafina Select Brazilwood Violin Bow 4/4 Size,Bellafina,Musical Instruments,Instrument Accessories,Orchestral Strings Accessories,Bows,134177.0
B0002F76QY,"Squier by Fender Affinity Telecaster Beginner Electric Guitar - Maple Fingerboard, Arctic White",Fender,Musical Instruments,Guitars,Electric Guitars,Solid Body,4594.0
B0002H0DLM,C414BULS,,Musical Instruments,Microphones & Accessories,Microphones,,477154.0
B0007A9NYC,"25"" Blue Mini Guitar",,Musical Instruments,Guitars,,,582110.0
B0002F7AF6,Danmar Metal Impact Badge - Double Kick,Danmar,Musical Instruments,Instrument Accessories,Drum & Percussion Accessories,,27368.0
B0002GZIWM,"Shure WL93 Series Subminiature Condenser Lavalier Microphones,WL93- Black, with 4-foot (1.2 m) Cable",Shure,Musical Instruments,Microphones & Accessories,Microphones,Wireless Microphones & Systems,12101.0
B0009H611Q,Humes &amp; Berg Enduro DR550XABK 30 x 14.5 x 24.5 Trap Case with Casters and Metal Binding,Humes & Berg,Musical Instruments,Instrument Accessories,Drum & Percussion Accessories,Bags,355981.0
B0002KZIKU,Fender American Series Stratocaster Tremolo Arm Tension Springs,Fender,Musical Instruments,Instrument Accessories,Guitar & Bass Accessories,Electric Guitar Parts,692.0
B0002F7AEW,Pintech Percussion XT-18 18&quot; Crash/Ride Practice Cymbal,Pintech Percussion,Musical Instruments,Drums & Percussion,Electronic Drums,,146247.0
B00080F7BE,On Stage MSA7020B Top Mount Boom,OnStage,Musical Instruments,Microphones &amp; Accessories,Accessories,,90268.0
B0002KZQ9S,Behringer V-Tone Gm108 True Analog Modeling 15-Watt Guitar Amp With 8&quot; Speaker,Behringer,Musical Instruments,Studio Recording Equipment,,,142085.0
B0002EWR6E,Nino Percussion NINO540L-B Plastic Egg Shaker (Blue),Nino Percussion,Musical Instruments,Drums & Percussion,Hand Percussion,Folk & World,155433.0
B0007Y8GSM,"Meinl Percussion Artist Series Shaker, Luis Conte Signature-NOT Made in China-Soft Volume for Recording Sessions and Live Acoustic Shows, 2-Year Warranty, (SH5R)",Meinl Percussion,Musical Instruments,Drums & Percussion,Hand Percussion,Folk & World,30240.0
B0002F4X5Q,Yamaha Rubber Mallets Medium Soft,Yamaha,Musical Instruments,Instrument Accessories,Drum & Percussion Accessories,Drumsticks,268867.0
B0002HU6SM,Vic Firth American Custom Timpani -- Wood Head,Vic Firth,Musical Instruments,Drums &amp; Percussion,Drum Sets &amp; Set Components,Drums,63582.0
B0002ORPU2,Samson S-Amp 4-Channel Headphone Amp,Samson Technologies,Musical Instruments,Live Sound & Stage,Power Amplifiers,,94706.0
B0006MZN9U,"K &amp; S PRECISION METALS 504 0.062"" x 36"" Music Wire (3 Pack)",K&amp;S,Musical Instruments,Instrument Accessories,Keyboard Accessories,Music Wire,72256.0
B0007KPI0U,"VIOLINSMART MV01 Violin Package (Size: 4/4, Color: Black)",ViolinSmart,Musical Instruments,Band &amp; Orchestra,Orchestral Strings,Violins,147958.0
B0006ZNBC8,TREMOLO STABILIZER HEAVY DUTY,WD Music,Musical Instruments,Instrument Accessories,Guitar & Bass Accessories,Electric Guitar Parts,63351.0
B0002GU7JQ,Applause by Ovation MBAP10 Tenor Ukulele/Mandolin Gigbag,Applause,Musical Instruments,Instrument Accessories,Folk & World Instrument Accessories,Mandolin Accessories,208353.0
B0002F6TDU,Paiste Signature Cymbal Full Ride 20-inch,Paiste,Musical Instruments,Drums &amp; Percussion,Drum Sets &amp; Set Components,Cymbals,36232.0
B0002L51PG,Hilo Standard Soprano Ukulele - Red,Hilo,Musical Instruments,Ukuleles, Mandolins &amp; Banjos,Ukuleles,205171.0
B0002GWK5U,Hardwood and Stainless Steel Dobro Bar,Shubb,Musical Instruments,Instrument Accessories,Guitar & Bass Accessories,Slides,10433.0
B0002F52XS,REMO 4 In Roto Trac-Packed,Remo,Musical Instruments,Instrument Accessories,Drum & Percussion Accessories,Concert Percussion Accessories,337834.0
B0007P2PNS,Elemental Designs eDead 45 Sound Deadening - 20Sq. Ft.,Elemental Designs,Musical Instruments,Studio Recording Equipment,Studio Environment,Acoustical Treatments,460984.0
B0002LDG5S,"Curry SS Trumpet Sound Sleeve, Regular",curry,Musical Instruments,Instrument Accessories,Brass Accessories,Cleaning & Care,181599.0
B0002IHN3C,ACE CA1M 500 mA Multi-Voltage Variable Adapter,ACE,Musical Instruments,Instrument Accessories,Keyboard Accessories,Power Supplies,219841.0
B0006BFS4Q,"Eminence Legend CB158 15"" Bass Guitar Speaker, 300 Watts at 8 Ohms",Eminence,Musical Instruments,Instrument Accessories,Guitar &amp; Bass Accessories,Amplifier Accessories,101562.0
B0002GJRNI,"Dean Bluegrass F Style Mandolin, Vintage Sunburst",Dean Guitars,Musical Instruments,Ukuleles, Mandolins &amp; Banjos,Mandolins,222029.0
B00062N4P0,Prestige Hearing Frequency Tuning Fork,PRESTIGE,Musical Instruments,Instrument Accessories,General Accessories,Tuning,209134.0
B0002ORMRS,Raxxess AR5 Accessory Riser Mounting Device,Raxxess,Musical Instruments,Studio Recording Equipment,Studio Environment,Furniture,143374.0
B0002GO1QQ,Rotosound RS885LD Black Nylon Flatwound 5 String Bass Guitar Strings (65-135),ROTOSOUND,Musical Instruments,Instrument Accessories,Guitar &amp; Bass Accessories,Strings,23408.0
B0002KZ8PU,Metrognome Micro Metronome,Korg,Musical Instruments,Instrument Accessories,General Accessories,Metronomes,364238.0
B0002EJREE,Rhythm Band Claves Select Hardwood,Rhythm Band,Musical Instruments,Drums & Percussion,Hand Percussion,Folk & World,49338.0
B0002MTGVU,"Remo Spring Drum, 4"" Diameter, 10"" Length, Angled On One End, Stormy Graphics",Remo,Musical Instruments,Instrument Accessories,Drum &amp; Percussion Accessories,,143322.0
B0006MZN22,"Penn Elcom R0828/12 Steel Rack Rail for Mounting Audio, Home Theatre, Recording Studio, PA Equipment, IT, One Pair Tapped and Thredded for 10/32 UNF, M5 or M6, 12 Rack Spaces (12U)",Penn Elcom,Musical Instruments,Studio Recording Equipment,Studio Environment,Rack Accessories,91626.0
B0002F6RTQ,Musician's Gear MC22LP Deluxe Hardshell Case Black,Musician's Gear,Musical Instruments,Instrument Accessories,Guitar & Bass Accessories,Bags & Cases,186569.0
B0006ODWVE,"Shure WBH53B Headworn Vocal Microphone for Wireless, Omnidirectional Condenser",Shure,Musical Instruments,Microphones & Accessories,Microphones,Condenser Microphones,103640.0
B0002GO6C0,SKB Mixer Safe 33 X 31 Universal Mixing Board Case,SKB,Musical Instruments,Electronic Music, DJ &amp; Karaoke,DJ Equipment,361073.0
B0006VYYDW,Seiko STM-20 Clip-On Tuner Pick-UP Tuner,Seiko,Musical Instruments,Instrument Accessories,Guitar &amp; Bass Accessories,Tuners,212520.0
B0002F78OE,Pintech Percussion TC16 16&quot; Trigger Cymbal,Pintech Percussion,Musical Instruments,Drums & Percussion,Electronic Drums,Triggers,62397.0
B00081P09M,Aquarian Drumheads Drumhead Pack (VTC-M14),Aquarian Drumheads,Musical Instruments,Drums & Percussion,,,17732.0
B0002IGVVC,Shure MX202B/C Condenser Microphone - Cardioid,Shure,Musical Instruments,Microphones & Accessories,Microphones,Condenser Microphones,66933.0
B0002F4VV2,"Vater 5A Xtreme Design Hickory Drum Sticks, Pair",Vater,Musical Instruments,Instrument Accessories,Drum & Percussion Accessories,Drumsticks,37665.0
B0002H0RQ8,"Lee Oskar Harmonica, Melody Maker Key of G",Lee Oskar Harmonicas,Musical Instruments,Wind & Woodwind Instruments,Folk & World,Harmonicas,33175.0
B0006VWYB6,Trombotine Trombone Slide Lubricant,Trombotine,Musical Instruments,Instrument Accessories,Brass Accessories,Cleaning & Care,12048.0
B0006ZP5AO,Littlite L-18X-LED 18&quot; Gooseneck Light with 3 Pin XLR Connector LED Lamp,Littlite,Musical Instruments,Live Sound & Stage,Lighting Equipment & Accessories,Lighting Accessories,93296.0
B0002F729U,Traveler Guitar EG-1 Standard Electric Travel Guitar with Gig Bag (Red),Traveler Guitar,Musical Instruments,Guitars,Electric Guitars,Solid Body,244617.0
B00064TZYW,Washburn RO10 Rover Steel String Travel Acoustic Guitar - Natural),Washburn,Musical Instruments,Guitars,Acoustic Guitars,Steel-string Acoustics,43231.0
B0002L044E,Fender Deluxe Case for Jazz Bass - Tweed,Fender,Musical Instruments,Instrument Accessories,Guitar &amp; Bass Accessories,Bags &amp; Cases,149400.0
B0002F5152,"Vater VBSW Sweep Retractable Wire Drum Brushes, Pair",Vater,Musical Instruments,Instrument Accessories,Drum &amp; Percussion Accessories,Drumsticks,31702.0
B0009VCPVM,"Shakuhachi, &quot;EE&quot;",Mid-East,Musical Instruments,Band & Orchestra,Wind & Woodwinds,Flutes,60549.0
B0002NN3FY,Whirlwind EDB1 1-channel Passive Instrument Direct Box,Whirlwind,Musical Instruments,Studio Recording Equipment,Signal Processors,Direct Boxes,27621.0
B0006HBP2O,Symetrix 528E Voice Processor,Symetrix,Musical Instruments,Studio Recording Equipment,Signal Processors,Effects Processors,260993.0
B0009H00X6,EMINENCE PRIVATEJACK16 12-Inch Lead/Rhythm Guitar Speakers,Eminence,Musical Instruments,Studio Recording Equipment,,,76509.0
B0002VU0SE,American Dj Stage Pak 1 Conventional Lighting Dimmer Control System,Elation Control,Musical Instruments,Live Sound & Stage,Lighting Equipment & Accessories,Lighting Accessories,140329.0
B0007Y2D0O,Cleartone Acoustic.012-.053 Light Strings,Cleartone Strings,Musical Instruments,Instrument Accessories,Guitar & Bass Accessories,Strings,9900.0
B0002JFPHM,Otto Link OLM-404-6 Super Tone Master Metal Tenor Sax Mouthpiece,Otto Link,Musical Instruments,Instrument Accessories,Wind & Woodwind Accessories,Mouthpieces,156987.0
B0002FOIFQ,Humitron Bass Humidifier,Humitron,Musical Instruments,Instrument Accessories,Orchestral Strings Accessories,,158781.0
B0002GNUYU,Rotosound RS88LD Black Nylon Flatwound Bass Guitar Strings (65 75 100 115),ROTOSOUND,Musical Instruments,Instrument Accessories,Guitar & Bass Accessories,Strings,18510.0
B0002L52RI,Oscar Schmidt AC449 Autoharp Case,Oscar Schmidt,Musical Instruments,Instrument Accessories,Folk & World Instrument Accessories,Autoharp Accessories,45963.0
B0002OSBBO,Jean Baptiste MP18C Tuba Mouthpiece,Jean Baptiste,Musical Instruments,Instrument Accessories,Brass Accessories,Mouthpieces,123590.0
B0002F59RM,BERP Buzz Extension and Resistance Piece for Large Shank Trombone/Euphonium Trombone Large Shank,BERP,Musical Instruments,Instrument Accessories,Brass Accessories,,32664.0
B0006LOBBM,D'Addario J66 Custom Tenor Guitar Strings,D'Addario,Musical Instruments,Instrument Accessories,Guitar &amp; Bass Accessories,Strings,26524.0
B00076IR7U,Dean LL EG Lightweight Case for Solid Body Electric Guitars,Dean Guitars,Musical Instruments,Guitars,Electric Guitars,Solid Body,214515.0
B0009GWNOG,ART SLA2 200W Power Amplifier,ART,Musical Instruments,Live Sound & Stage,Power Amplifiers,,78568.0
B00061ZM2Y,M-Audio Fast Track US44010 USB Audio Interface with GT-Player Express Software,M-Audio,Musical Instruments,Studio Recording Equipment,Computer Recording,Audio Interfaces,74521.0
B0002GLGUA,Vestax PMC-05PROIII VCA DJ Mixer,,Musical Instruments,Studio Recording Equipment,Mixers & Accessories,Mixers,1775344.0
B0002F517U,Vater Poly Brush with Retractable Nylon Bristles,Vater,Musical Instruments,Instrument Accessories,Drum &amp; Percussion Accessories,Drumsticks,37039.0
B00030CGOA,"D'Addario Prelude Viola Single G String, Medium Scale, Medium Tension",D'Addario,Musical Instruments,Instrument Accessories,Orchestral Strings Accessories,Strings,153412.0
B00074IITO,"Levy's Leathers MS12-BLK 2&quot; Hand-Brushed Suede Guitar Strap, Black",Levy's Leathers,Musical Instruments,Instrument Accessories,Guitar & Bass Accessories,Straps & Strap Locks,7539.0
B0002U4860,Sennheiser E815S-C Cardioid Dynamic Vocal Microphone with Shock Mounted Capsule,Sennheiser,Musical Instruments,Microphones &amp; Accessories,Microphones,Dynamic Microphones,368.0
B0002F51B6,LPM199-AW LPMC Mini Tunable Natural Wood Bongos,Latin Percussion,Musical Instruments,Drums &amp; Percussion,Folk &amp; World Hand Drums,Bongos,32712.0
B0009V84NA,Mid-East TBSP Professional Tabla Set,Mid-East,Musical Instruments,Drums &amp; Percussion,Folk &amp; World Hand Drums,Tablas,146997.0
B0002F4VC6,DigiTech DSB Screamin' Blues Overdrive Analog Distortion Pedal,DigiTech,Musical Instruments,Amplifiers & Effects,Guitar Effects,Electric Guitar Effects,116218.0
B000972F2U,Paiste PST 5 Cymbal Splash 10-inch,Paiste,Musical Instruments,Drums & Percussion,Drum Sets & Set Components,Cymbals,256291.0
B0002F787G,Gibraltar SC-CFS/4 Cymbal Felts Short 4/Pack,Gibraltar,Musical Instruments,Instrument Accessories,Drum & Percussion Accessories,,30889.0
B0009FUTHU,Danelectro D-3 Fab Metal Effects Pedal,Danelectro,Musical Instruments,Amplifiers & Effects,Guitar Effects,Electric Guitar Effects,21943.0
B0002GVBYG,West Music Canvas Music Bag,West Music,Musical Instruments,Instrument Accessories,General Accessories,,449576.0
B0002ZO5Z4,On Stage MY700 Stereo Microphone Bar,OnStage,Musical Instruments,Microphones & Accessories,Accessories,Clips,23434.0
B0002F7IBM,Axis Sonic Hammer Variable Length Bass Drum Beater,AXIS,Musical Instruments,Instrument Accessories,Drum & Percussion Accessories,Drum Set Accessories,88143.0
B0007XVJH8,"Meinl Percussion TMB-S Double Braced Tripod Bongo Stand for Seated Players, Chrome",Meinl Percussion,Musical Instruments,Instrument Accessories,Drum & Percussion Accessories,,167801.0
B0006ZRN22,BONE SADDLE OVERSIZE - 90mm X 11mm X 3.5mm,WD Music,Musical Instruments,Instrument Accessories,Guitar &amp; Bass Accessories,Electric Guitar Parts,104330.0
B0002GLMPE,Oscar Schmidt OU53S Baritone Ukulele,Oscar Schmidt,Musical Instruments,Ukuleles, Mandolins & Banjos,Ukuleles,46446.0
B0002O7LMY,Audix OM3 Live Vocal Mic,Audix,Musical Instruments,Microphones & Accessories,Microphones,,35209.0
B0006B3T42,LittLite 12G-LED - Gen V LED Gooseneck Light,Littlite,Musical Instruments,Studio Recording Equipment,,,90062.0
B0007W8NBE,"Barcelona Beginner Series Double Cutaway Electric Guitar Bundle with 10-Watt Amp, Gig Bag, Strap, and Accessories - Metallic Red",The Music Shack,Musical Instruments,Guitars,Electric Guitars,Solid Body,418211.0
B0002J6ISC,Road Ready RRCDJ CD Player Case for Pioneer CDJ1000,Road Ready,Musical Instruments,Electronic Music, DJ &amp; Karaoke,DJ Equipment,156545.0
B0002EJORY,Selmer Music Stand (P801514),SELMER,Musical Instruments,Instrument Accessories,General Accessories,Conducting Batons,180077.0
B0002F7J98,Remo BD0316-00 Clear Diplomat Drum Head - 16-Inch,Remo,Musical Instruments,Instrument Accessories,Drum & Percussion Accessories,Drum Set Accessories,17540.0
B0002II67E,Gibraltar SC-MCSA4 4 Inch Mini Cymbal Stacker,Gibraltar,Musical Instruments,Instrument Accessories,Drum &amp; Percussion Accessories,Hardware,32277.0
B0002F4VTY,Players Products Acoustic Guitar Bridge Pins (MKHTR-SS),Players,Musical Instruments,Instrument Accessories,Brass Accessories,Cleaning &amp; Care,43700.0
